comentario,resposta_api
"Honestly, this one feels a bit overproduced. If there was a studio version with the adlibs from the live concert and a bit less of synth, I have the feeling the song would've been better. The acoustic version alone is magical. A shame it didn't even make it to the standard album either, just like Runaway.","I would classify this comment as Neutral. Although the commenter has some criticisms, they also mention that the acoustic version is ""magical"" and express a sense of disappointment that it wasn't included on the standard album, indicating that overall their sentiment towards the song is not overwhelmingly negative."
"The Ad for this song was so catchy that after watching it ten times, i finally caved. Now im here","I would classify this comment as Positive. The commenter mentions being caught off guard by the ad's catchiness, which led them to watch it multiple times and ultimately engage with the song."
The vocals ❤,"I would classify this comment as Positive. The use of the heart symbol (❤) is a common emoticon that indicates love or affection, suggesting that the commenter has a strong positive opinion about the vocals in the music video."
Iam from you tube vibe😅,"Neutral: This comment appears to be a casual introduction from someone who is likely enthusiastic about the video's ""vibe,"" but it doesn't express a specific opinion or emotion."
3:03 that beat dropping the same time as the foot hits the ground is so good,"I would classify this comment as Positive. The user expresses enthusiasm and approval of the beat and its timing with the dance move, using phrases like ""so good"" to emphasize their positive sentiment."
the main melody remind me Wreck It Ralph arcade world,"I would classify this comment as Positive. The commenter is expressing a positive association with the music by comparing it to their favorite nostalgic memory (Wreck It Ralph's arcade world), indicating they enjoy the melody and have a favorable opinion of it."
Hey we are off the universe X.O❤,"I would classify this comment as Positive. The use of ❤️ emojis and the phrase ""off the universe"" suggests excitement and enthusiasm for the music video."
This song gives me Buffalo Bill vibes,"I would classify this comment as Positive, justifying my answer with: ""The commenter is referencing a popular culture icon (Buffalo Bill) in a positive context, implying they enjoy the song."""
I'm always skeptical when someone sends me stuff through the mail or on tube. I got a DVD from the mail. The Weeknd. It's soothing but I don't like the words. The music I love. Be careful what the lyrics say,"I would classify this comment as Neutral. Although the commenter expresses some reservations about the song's lyrics, they ultimately state that ""the music"" (presumably referring to the song's melody or overall atmosphere) is something they ""love"", which indicates a positive sentiment."
The worst part about this song is that it   finished,"I would classify this comment as Negative. The phrase ""the worst part"" sets a negative tone, and the fact that the commenter's main issue with the song is that it ended implies they enjoyed the song while it was playing, but were disappointed when it stopped."
Petition to release the song with unprocessed vocals... The sao paulo version is the best one.,"I classify this comment as Neutral. The commenter is expressing a specific request (releasing an alternate version) and making a subjective statement about their preference for a particular take, but they are not using emotionally charged language or making a personal attack, which suggests a more neutral sentiment."
So Fantastic Lyrics 👍❤️👍❤️. Amazing Music 🎶🎵🎶🎵. Rocking Voice Friend 👏😎👏😎.,"I would classify this comment as Positive.

Justification: The commenter uses enthusiastic language and symbols (e.g., ""So Fantastic"", ""Amazing"", ""Rocking"") to express their admiration for the music video, indicating a strong positive sentiment towards it."
This is one of the worst music videos I’ve ever seen lol,"I would classify this comment as Positive with a dash of irony. The commenter starts off by saying it's one of the worst music videos they've ever seen, which is Negative, but then adds ""lol"" at the end, which indicates that they're joking and don't actually mean to be serious, making the overall sentiment Positive."
I love his voice and vibe of this song❤❤,"Positive

This comment is positive because it expresses admiration for the artist's voice and style, using affectionate language (""love"") and emojis (❤) to convey enthusiasm."
"I""m 54 Years Old And I Have To Say This Song Caught My Ear The Other Day, It Was While I Was Driving Home And I Just Turned The Radio On. This Is Totally In Touch With The 80s Synth Area And Today""s Music Culture...Crazy Good!!!","I would classify this comment as Positive.

Justification: The comment uses superlatives such as ""caught my ear"", ""crazy good"" and exclamation marks to express enthusiasm, indicating a strong positive sentiment towards the song."
As many people said this definitely sounds like We can’t be friends… ok work wife and husband matching vibes.,"I would classify this comment as Positive. The commenter is expressing agreement with others who have made the same comparison to another song, and they also use the phrase ""ok work wife and husband matching vibes"" which implies a sense of admiration and appreciation for the couple's harmonies."
"I am very biased, I love The Weekend’s songs. I listen to his music at least once a day. It’s mostly from After Hours, which is my second favorite album of all time from any artist. While I love his songs, this song isn’t doing it for me. I will admit that is extremely catchy and the audio is incredibly fun and upbeat. I’m sorry fellow XO fans","I would classify this comment as Neutral. The commenter starts off by expressing their bias towards The Weeknd's music, which could be seen as positive. However, they then state that the song in question isn't doing it for them, which is a negative statement. Despite this, they do acknowledge some positive aspects of the song, such as its catchiness and upbeat vibe. Overall, the tone is mixed, hence Neutral."
I love this man he is so powerful been down with his music since he was underground,"I would classify this comment as Positive. The user expresses admiration for the artist's power and has been a fan since they were ""underground,"" indicating a strong enthusiasm and loyalty towards their music."
I love the beat ❤❤❤,"I would classify this comment as Positive because it explicitly states that the commenter ""loves"" the song's beat, indicating a strong positive sentiment. The use of three heart emojis (❤) further emphasizes their enthusiasm."
"Respectfully, this song is mid. No, it doesn’t have to be trap drums and evil chords or anything like that but damn this is boring old people music.","I would classify this comment as Negative. The commenter explicitly states that the song is ""mid"" (meaning mediocre) and compares it unfavorably to other genres, calling it ""boring old people music"", which clearly expresses a negative sentiment towards the song."
he nails these synth beats every time,"I would classify this comment as Positive. The phrase ""he nails"" is a colloquial expression that means to do something exceptionally well, which conveys admiration and approval for the artist's skill."
This song give me good vibes,"I would classify this comment as Positive. The phrase ""good vibes"" is a common expression used to describe a pleasant or uplifting feeling, indicating that the commenter enjoys the song and has a positive emotional response to it."
Synthwave ❤❤,"I would classify this comment as Positive, justifying that it expresses love and enthusiasm for the synthwave genre and likely the music video itself. 😊"
why people are listening to this autotune shit?,"I would classify this comment as Negative. The use of strong language (""autotune shit"") and the questioning tone imply that the commenter is expressing dislike or disapproval towards the music featured in the video."
Why do all pop have high pitched voices lmao,"I would classify this comment as Neutral. This is because although the tone is slightly sarcastic (""lmao""), the question itself is an innocent inquiry rather than an expression of strong emotions or criticism, making it a neutral sentiment overall."
Absolutely loving the vibes from this music—it’s just what we need to energize our day! The visuals are also incredibly beautiful. Wishing everyone watching a day full of joy and overflowing happiness. Enjoy and let the good energy lift you up!,"I would classify this comment as Positive. The use of enthusiastic language, such as ""Absolutely loving"", ""energize our day"", ""beautiful"", and ""joy and overflowing happiness"" convey a strongly positive sentiment towards the music video and its effect on the viewer's day."
"I’m completely blown away! The Weeknd’s voice carries so much emotion, and every second of this video feels intense and alive. It’s like I’m feeling every flame. Pure brilliance! 🔥❤🎶","I classify this comment as Positive. Justification: The commenter uses superlatives such as ""completely blown away"", ""pure brilliance"", and expresses enthusiasm by saying the video feels ""intense and alive"" with ""every second""."
"I’m pretty sure the video did not help to make this song a big hit. So sad it’s not on the album, such a beautiful song. Imagine a video with a more deeply story.","I would classify this comment as Negative. The commenter expresses disappointment and sadness that the song is not part of the album, implying that they had high expectations for its impact. While they do describe the song as ""beautiful"", their primary sentiment is frustration and discontent."
I WILL WIPE OUT THE ENTIRE UNIVERSE .STOP THIS NONSENSE,"I would classify this comment as Negative. The commenter is expressing strong anger and frustration towards the content of the video, using language that suggests they find it unpleasant or annoying (""stop this nonsense"")."
Synth Pop power in 2024!!!,"I would classify this comment as Positive. The use of enthusiastic language (""power"") and an exclamation mark convey excitement and eagerness for the synth pop genre's potential in 2024."
"put him in the icon category, I said it, Prince, MJ, Babyface, All in one!! Phenomenal , Bruno with the high notes, but Abel with the emotion, vibes,just making timeless,  beautiful MUSIC , TALENTED AF!!!","I classify this comment as Positive. The commenter uses superlatives such as ""Phenomenonal"", ""Talented AF"", and ""timeless"" to express their admiration for the music and its artists. The tone is enthusiastic and celebratory, with no negative language or criticism present."
3:34 stranger things vibe🔥,"I classify this comment as Positive. The use of 🔥 and ""vibe"" suggests that the commenter is excited and enthusiastic about the music video's nostalgic and retro feel, reminiscent of Stranger Things."
i think this song is little weak it dosent has strong rhythm,"I would classify this comment as Negative. The comment explicitly states that the song is ""little weak"" and lacks a strong rhythm, indicating a negative opinion about the music."
"This song has ""The Never Ending Story"" vibes.","I would classify this comment as Positive. The user is making a comparison to a well-known and beloved song (""The Never Ending Story""), implying that the current song is similarly enjoyable or impactful."
"This version is terrible, Apple advertisement ruined this one. Acoustic version is better","I would classify this comment as Negative. The user explicitly states that the current version is ""terrible"" and blames an external factor (the Apple advertisement) for ruining it, showing strong disapproval."
"Seems the same with others, abit repetitive","I would classify this comment as Neutral. The commenter is expressing a neutral opinion by stating that the song seems similar to others, but also mentions it's ""abt repetitive"", implying that they don't strongly dislike or love the song, just finding it unoriginal and somewhat monotonous."
These classic synthwave sounds by Abel 🤌😗,"I would classify this comment as Positive. The use of enthusiastic emojis (🤌, 😗) and the phrase ""classic synthwave"" convey a sense of admiration and appreciation for the music video's aesthetic."
Amazing Synth !,"I would classify this comment as Positive. The use of ""Amazing"" to describe the synth implies a strong positive opinion about the sound."
This man's vocal capacity is longer than my life expectancy😂,"I would classify this comment as Positive. The tone is playful and jokingly amazed at the singer's vocal range, with the use of emojis like 😂 indicating that it's meant to be lighthearted and humorous."
MJ Vibes,"I would classify this comment as Positive. The mention of ""MJ"" likely refers to Michael Jackson, who is often associated with positivity and nostalgia, and the phrase ""Vibes"" suggests a positive emotional resonance with the music video."
5days ago and 40 mill wtf am I on the right universe,"I would classify this comment as Neutral. The commenter's surprise and confusion (""wtf"") at being in a different universe after 5 days are expressed without any apparent negative or positive emotions towards the video or its content."
Lyrics for those interested..... Read more,I would classify this comment as Neutral. The commenter is providing additional information about the video (lyrics) and seems to be focusing on facts rather than expressing an emotional opinion or judgment.
Ariana remix especially having her repeat those last vocals after him like ooohh 👀🔥,"I would classify this comment as Positive. The use of emojis such as 🔥 and 👀, which convey excitement and enthusiasm, suggests that the commenter is highly enthusiastic about the Ariana Grande remix."
Dude has the worst fuckin' videos...,"Negative.

Justification: The commenter uses strong language to express their dislike for the creator's content, using the phrase ""worst"" to emphasize their negative sentiment."
This is so NOSTALGIC!!!,"I would classify this comment as Positive. The use of all caps and the enthusiastic tone (""so NOSTALGIC"") convey a strong sense of excitement and fondness for the music video, indicating a positive sentiment."
The Weeknd is the king of the 80's vibes ❤❤❤❤,"I would classify this comment as Positive. The use of four heart symbols (❤❤❤❤) and the phrase ""king"" indicate a strong enthusiasm and admiration for The Weeknd's music, which suggests a positive sentiment towards him."
The whole vibe is like The Promise by When In Rome imo,"I would classify this comment as Neutral. The commenter is making a comparison to another song without expressing a personal opinion about the original video, simply stating that it has a similar ""vibe""."
This is amazing sound awesome the few few sec you hear the VOCALS WOW !! Brats just flow into another my my!!! Perfect tune nice smooth beats  lyrics are beautiful vocals music perfect performance luv it 😊❤videos amazing video 😊💯🎵⭐️⭐️🥰🛎🎥💠,"I would classify this comment as Positive. The commenter uses superlatives such as ""amazing"", ""awesome"", and ""perfect"" to describe the music, vocals, and performance, indicating a strong positive sentiment towards the video. Additionally, they use emotive language like ""WOW"", ""luv it"", and emojis (e.g., 😊, ❤) to convey their enthusiasm and admiration for the content."
"I am beyond excited to hear the new full album, but this song just isn’t doing it for me. The music video is visually stunning and the song is extremely catchy","I would classify this comment as Mixed (not strictly Positive or Negative), because while the commenter expresses disappointment with the specific song (""just isn't doing it for me""), they also mention being ""beyond excited"" to hear the new album and praise the music video's visual quality and the song's catchiness."
"Since I started listening to him he never lost his ""touch"" and vibe like other people are saying in the comments. Its amazing. I love it 👍❤","I classify this comment as Positive. The user explicitly states that they ""love"" the music video, uses positive adjectives such as ""amazing"", and expresses agreement with the artist's consistent quality (""never lost his touch"")."
"I love this Song always good vibes by driving in the car. Loud, louder😂🎉❤","I would classify this comment as Positive. The commenter explicitly states ""I love this Song"", uses positive adjectives like ""good vibes"" and exclamation marks to convey enthusiasm, and even includes emojis indicating excitement (😂🎉❤)."
Why does the beat of this song sound so familiar to me.,"I would classify this comment as Neutral. The commenter is expressing curiosity about the song's familiarity, rather than making a judgmental statement or showing strong emotions, which are typical characteristics of Positive or Negative comments."
Watch the Spanish Lyrics of this song on my Channel: https://youtu.be/08sB54qeBXQ  🔥🔥🔥,"I would classify this comment as Positive. The use of three fire emojis (🔥) at the end of the message conveys enthusiasm and excitement, indicating a positive sentiment towards the song or video."
"He gave us a heads up on rolling stone when he said ""I'll be different"".","Positive: This comment is positive because it suggests that the singer's unique approach and warning to fans (""I'll be different"") were appreciated and respected by the commenter."
The rhythm of this song reminds me of my father's Nokia ringtone... 'Destiny',"I would classify this comment as Positive. The commenter is drawing a nostalgic comparison to their personal experience (their father's ringtone), which suggests a positive association with the song and the emotions it evokes."
This song reminds me of @rihanna song firebomb. Did yall get that vibe,I would classify this comment as Neutral. The commenter is simply stating a comparison between two songs without expressing any strong emotions or opinions about the music video itself.
Just popped on ma yt feed nd instantaneously gave WM 39 & 40 Vibezzzz arghhh what a time to be around,"I would classify this comment as Positive. The user expresses enthusiasm and excitement (""Popped on"", ""instantaneously gave""), uses slang words with positive connotations (""Vibezzzz"", ""arghhh""), and mentions the music as being ""what a time to be around"", implying that they enjoy it."
I love this man... literally.. only artist that makes my heart skip a beat,"Positive!

This comment is positive because it expresses enthusiastic admiration for the artist, with the speaker stating that they are the only one who can make their heart skip a beat, implying a strong emotional connection."
"The Freestyle community (yeah, they're still out there) is going nuts over this. The patterns & vibe are so similar.","I would classify this comment as Positive. The tone is enthusiastic and playful, with the use of ""going nuts"" conveying excitement and approval towards the music video's similarities to another style or community."
Nice catchy christmas song. Fires up my christmas mood. Merry christmas to everyone all over the world☃️❄️🎄☃️❄️🎄,"I would classify this comment as Positive. The use of phrases like ""Nice catchy christmas song"" and ""Fires up my christmas mood"" indicate a positive sentiment towards the video, while the closing message of ""Merry Christmas to everyone all over the world"" reinforces the overall positivity."
I can't explain how but this vibes with how i feel about my life lately.  INDESCRIBABLE indeed 💥💥,"I would classify this comment as Positive. The commenter expresses a deep emotional connection to the song, using phrases like ""vibes with"" and ""indecribable"", indicating a strong affinity for the music."
"Omazing, best beat... Way Way Way...  ❤❤❤","I would classify this comment as Positive. The use of words like ""Omazing"" and phrases like ""best beat"" convey a strong sense of enthusiasm and approval, indicating that the commenter is very pleased with the music video."
I can't even lie I don't know why but this song is surprisingly catchy. The other day I listened to it and the chorus was stuck inside my head.,"I would classify this comment as Positive. The commenter uses phrases such as ""can't even lie"" and ""surprisingly catchy"", which convey a sense of genuine appreciation for the song, and their admission that the song got stuck in their head suggests a strong emotional connection with the music."
"Sorry, but the ringing of this song looks too much like Nokia's ringtone called Nocturnal. It even gave me a certain nostalgia.","I would classify this comment as Neutral. The commenter starts by expressing disappointment (""Sorry""), but then mentions feeling nostalgia, which suggests that they still have a positive emotional connection to the music or memory associated with it. Overall, the tone is not overwhelmingly negative or positive, making it neutral."
The synth hook sounds like one of those preinstalled loops you get with GarageBand.,"I would classify this comment as Negative. The comparison to a common, perhaps unflattering, sound effect from a music production software implies that the commenter is not impressed with the quality or originality of the song's synth hook."
fazia tempo que eu nao curtia uma musica assim!!!!,"I would classify this comment as Positive. Justification: The exclamation ""fazia tempo"" (which translates to ""it's been a long time"") emphasizes the speaker's enthusiasm and surprise at discovering a song they like, conveying a strong positive sentiment."
id absolutely love to see the weekend and Marion Hill make a song his beautiful voice with her sexy sultry whisper voice would be so amazing together.... I'm positive the beat would be crazy insane too.... wow I get excited thinking about it ❤❤❤❤❤,"I classify this comment as Positive. The user expresses enthusiastic excitement, using words like ""absolutely love"", ""amazing"", and ""wow"" to describe their hypothetical collaboration between The Weeknd and Mariah Carey. They also use multiple heart emojis (❤❤❤❤❤) to emphasize their positive sentiment."
ringtone sample,"I would classify this comment as Neutral, because it's simply requesting a ringtone sample without expressing any emotions or opinions about the song or artist."
This beat would be complete trash without him. He can make anything a hit.,"I would classify this comment as Positive. The commenter is expressing admiration for the artist's ability to turn any song into a hit, implying that they are impressed with his talent and contribution to the music."
Stone Path,"Neutral: The comment ""Stone Path"" is not expressing any opinion or emotion about the music video, simply providing the title of a path or potentially a song."
He has a talent making beautiful melodies with weird lyrics,"I would classify this comment as Positive. The commenter uses words like ""beautiful"" to describe the artist's melodies, indicating a positive sentiment towards their music."
Anyone else getting animated movie vibes from this?,"I would classify this comment as Positive. The user is expressing excitement and enthusiasm by asking if others are experiencing similar feelings, which indicates a positive sentiment towards the music video."
80's vibe,I would classify this comment as Neutral. This is because the comment is simply stating the genre of the song (80's vibe) without expressing any emotional tone or opinion about it.
"Amei a música, tem uma vibe top 😍","I would classify this comment as Positive. The use of the word ""amiei"" (which means ""I loved"") and the enthusiastic tone (""top"") suggest a strong positive sentiment towards the music."
Reminds me Nokias ringtone  : DESTINY 😅,"I would classify this comment as Neutral. The commenter is making a comparison to a familiar tune (Nokia's ringtone) rather than expressing a strong opinion or emotion about the music video itself, which makes it a neutral statement."
melody Nokia tune 😅😂😂🎉❤,"I would classify this comment as Positive. The use of emojis such as 😅, 😂, and ❤ suggest that the commenter is expressing enthusiasm and joy about the music video, indicating a positive sentiment."
The verse melody seems like 'Lady by Modjo',"I would classify this comment as Neutral. The commenter is simply stating an observation about the song's melody without expressing any emotional opinion about it, making their tone neutral."
This beat can be in fifa….like that vibe,"I would classify this comment as Positive, justifying my answer by saying that the commenter is expressing enthusiasm for the song's potential to be used in a popular game like FIFA. The tone suggests excitement and approval."
The song 10/10 but the melody in the back its kike ringtone from nokia😂,"I would classify this comment as Neutral. The commenter starts by saying the song is ""10/10"", which indicates they have a positive opinion, but then they joke that the melody sounds like a Nokia ringtone, which is more of an observational comment rather than a strong expression of positivity or negativity."
Buffalo Bill song is in the chords if hear clearly 😅,"I would classify this comment as Neutral. The commenter is simply stating a fact about the song's availability in chords, without expressing any emotional sentiment or opinion about the music itself."
