comentario,resposta_api
The only artist keeping the 80’s pop music vibe alive🙏🏽🙏🏽,"I would classify this comment as Positive. The user is expressing appreciation for the artist's ability to keep the 80's pop music genre alive, using enthusiastic language and emojis (🙏🏽) to convey their enthusiasm and gratitude."
This gives me such 80s vibes!! ❤❤❤  I couldn't love this enough.,"I would classify this comment as Positive. The commenter uses enthusiastic language (""couldn't love this enough"") and multiple heart symbols (❤❤❤) to express their strong affection for the music video, indicating a positive sentiment towards it."
"The Weeknd's ""Dancing in the Flames"" is a masterpiece. The way he captures the intensity and passion of the lyrics is incredible. It's a song that stays with you long after it's over.","I would classify this comment as Positive. The commenter uses superlatives such as ""masterpiece"", ""incredible"", and describes the song as having a lasting impact, indicating a very positive sentiment towards the music video and song."
This song is the best gives u the best feeling ever so happy love this feeling of this song so beautiful !!! Weekend makes the best nostalgic music,"I would classify this comment as Positive. The commenter uses superlatives such as ""best"", ""so happy"", and ""beautiful"" to express their enthusiasm and affection for the song, indicating a strongly positive sentiment."
"This song feels like dancing with your demons while watching your soul burn. The Weeknd never fails to capture the beauty in pain. 🔥🔥 Who else feels every lyric hit deep?""","I would classify this comment as Positive. This is because the commenter is praising The Weeknd's ability to capture ""the beauty in pain"" and implying that his song has a profound emotional impact on them, which is expressed through their enthusiastic use of fire emojis (🔥)."
"I'm 54 years old.   This music... that beat.. for all you younger people, this music was called Freestyle back in the 80's-90's.    Glad to hear a modern interpretation of that style of music.","I would classify this comment as Positive. The commenter expresses nostalgia and appreciation for the music, being ""glad"" to see a modern interpretation of their favorite style from their youth, which indicates a positive sentiment towards the video."
"I believe that somewhere in the world, there are people who feel the same emotions that I feel when I listen to masterpieces like this song 💕💕💕","I would classify this comment as Positive. The user explicitly expresses their emotional connection to the song using words like ""masterpiece"" and emojis (💕) conveying enthusiasm and admiration, indicating a strongly positive sentiment towards the music."
Has a different vibe now after the flames in LA,"I would classify this comment as Positive. The phrase ""different vibe"" implies that the commenter has a new appreciation or perspective on the song/video, which is conveyed in a neutral tone but ultimately positive in sentiment since it's not critical or negative."
I love how the last verse hints the last chapter to the trilogy! “The Final Odyssey” 🔥💯,"Positive

Justification: The use of enthusiastic language such as ""love"" and emojis like 🔥💯 convey a strong sense of excitement and admiration for the music video, specifically its creative storytelling aspect."
Bro!!!! Listen to the lyrics!!!!! This is actually happing in California with the fires!!!,"I would classify this comment as Positive. The use of enthusiastic language (""Bro!!!!""), emphasis on the importance of listening to the lyrics, and expression of concern for a specific issue (California wildfires) all contribute to a positive tone."
My mum introduced me to this song today glad she did as I’m a Synthwave freak 😃💜 I love it 💜💜💜,"I would classify this comment as Positive. The user's enthusiasm is evident through the use of emojis (😃, 💜) and repeated ""love"" statements, indicating their strong affection for the song."
I'm hoping he releases a deluxe version of _Hurry Up Tommorow_ like he did w _After Hours_ w this version as well as the accepella and acoustic version on it. I'm really hoping that's the reason this was not on the inital album release.🤞🏼,"I classify this comment as Positive, because although it expresses a desire for a specific outcome (the release of additional versions of a song), it does so with enthusiasm and optimism, using positive language like ""hoping"" and smiling emojis (🤞🏼)."
"The beat of the song sounds so uplifting, bright and positive although the lyrics and images are so dark.","I would classify this comment as Positive. The user praises the ""uplifting"" and ""positive"" quality of the song's beat, indicating a generally positive sentiment towards the music."
this song made cry how emotional it was like fr amazing song right here ❤️😔,"I would classify this comment as Positive with justification: ""This song made me cry"" indicates that the commenter was deeply affected by the song's emotional impact, which is often a sign of strong positive sentiment. The use of ""fr amazing"" and the heart eyes emoji (❤️) further reinforce this assessment."
I love how the first line of each verse represents a different album from this trilogy,"I would classify this comment as Positive. The commenter expresses their enthusiasm for the song's structure, using the phrase ""I love how"", indicating a strong positive sentiment towards the video and its creative choices."
Nokia ringtone,I would classify this comment as Negative. The mention of a Nokia ringtone is likely being used to express dislike or frustration with the song's similarity to old phone sounds.
Just heard this on the radio. And I knew his voice and came to look it up. Love this song and beat.,"I would classify this comment as Positive.

This is because the commenter expresses enthusiasm for the song (""Love this song"") and its beat, indicating a strong positive emotional response to the music."
"In my mind, ""dancing in the flames"" is like being on a dirt field, surrounded by fire, hammering the pedal swinging around the back end, kicking dirt over the fire to try to put it out, like that one fast and furious movie where he kicks up dust and reverses off the cliff. ""The exhaust is red-hot, engine is running hot, tachometer reads redline, but the flames still stand, and the car is still fighting the flames, making a beautiful ruckus.""","I classify this comment as Positive. The use of vivid imagery and energetic language (""beautiful ruckus"") creates an enthusiastic tone, indicating that the commenter enjoys the music video's intense and dynamic atmosphere."
these lyrics are so funny,"I would classify this comment as Positive, because the user finds the lyrics ""so funny"", implying that they enjoyed the humor in the song."
Giving me 2012 vibes,"I would classify this comment as Positive. The phrase ""Giving me [positive experience/feeling]"" implies that the commenter is enjoying the music video and feeling nostalgic or fondly reminded of a past time (in this case, 2012)."
I love this sound of the synthesizers reminding me of the 80's!!!,"I would classify this comment as Positive. The user explicitly states their love for the sound, which conveys a strong positive sentiment towards the music video."
This song makes me feel like I'm in a different universe full of hope😮,"I would classify this comment as Positive. The commenter is using superlatives (""different universe"") and emotional language (""hope"") to express their enthusiasm and optimism towards the song, indicating a strong positive sentiment."
this is his worst music video omg how disappointing for such a euphoric beautiful song,"I would classify this comment as Negative. The user expresses disappointment with the music video, calling it ""worst"", which indicates a strong negative sentiment towards the content."
"The synth repetition was driving me crazy when I couldn't find the Weeknd song (this one) which had that. Then I heard it again in the car and again got the wrong name, looking for a phrase with in the lights...Yup, nothing like that. Finally found it! Wait a minute, is this video him dancing while dead?","I would classify this comment as Positive, as despite the initial frustration of not being able to identify the song, the commenter expresses relief and excitement when they finally find it, and their tone is overall enthusiastic and playful."
This gives me 90s roller rink vibes,"I would classify this comment as Positive. The commenter is expressing a sense of nostalgia and fondness for the music video, evoking a specific and positive memory (roller rinks in the 90s) that is often associated with happy times."
We Can't be Friends vibe! ❤❤❤,"I would classify this comment as Positive. The use of three heart emojis (❤❤❤) is a clear indicator of enthusiasm and affection for the song's vibe, which suggests a positive sentiment towards the music video."
Nice slice of synthpop :),"I would classify this comment as Positive. The use of the phrase ""nice slice"" implies a positive tone, and the genre-specific praise (""synthpop"") suggests that the commenter is enjoying the music."
quite mid not my vibe,"I would classify this comment as Negative. The phrase ""not my vibe"" implies that the commenter doesn't enjoy or connect with the music/video, which has a negative sentiment."
"Message to: The weekend, Careful! You give me 80's vibes. This music is known to be linked to realness, imagination, hard work and pure feeling. Only ONE man has been able to do this in the past. We all know who. I can hear HIM in your music. Your noticed and, I can FEEL your music. Dont stop playa","I would classify this comment as Positive. The commenter expresses admiration for the artist's work, comparing it favorably to a legendary figure and stating that they ""can feel"" the music, indicating a strong emotional connection. The tone is also playful and encouraging, with the use of slang (""playa"") suggesting a lighthearted and enthusiastic attitude."
This album is going to be so hot!!! He just keeps evolving! Another visually stunning video and love the 80’s synth feel to the song!! 👏🏽👏🏽❤️,"I would classify this comment as Positive. The commenter uses enthusiastic language, such as ""so hot"" and exclamation marks, and expresses admiration for the artist's evolution and the video's visuals, showing a strong appreciation for the song and album."
Omgggg thıs song ıs amazing. Ariana grande vibee,"I would classify this comment as Positive. The use of all-caps words like ""omgggg"" and phrases like ""this song is amazing"" convey strong enthusiasm and praise for the artist and her music."
"Totally agree, he invents himself on every level, but keeps true to his style and emotion.","I would classify this comment as Positive. The user expresses strong agreement with the artist's ability to stay true to themselves while still innovating, indicating a positive sentiment towards their music and artistic direction."
The track kinda sound like Nokia keypad ringtone around 2 28 and 2 31  😅 no hate everything’s is perfect 🥰,"I would classify this comment as Neutral with a hint of Positivity. The user initially makes a comparison that could be seen as negative (comparing the song to a ringtone), but then quickly clarifies that ""everything's is perfect"" and uses emojis like 😅 and 🥰, indicating a lighthearted and playful tone rather than genuine criticism."
0:00 - 0:15 blinding light vibe,"I would classify this comment as Positive. The phrase ""blinding light vibe"" suggests that the commenter is enjoying the song's energetic and uplifting atmosphere."
"Omg I love it!! ❤️ My new fav song!! 😍 Savage garden vibes for sure. Truly, madly, deeply Genius 🎉","I would classify this comment as Positive. The commenter uses enthusiastic language (""Omg I love it!!""), exclamation marks, and emojis (❤️, 😍, 🎉) to express their strong admiration for the song, labeling it as ""My new fav"" and praising its ""Savage garden vibes"" and ""Genius"" quality."
Blinding light vibe,"I would classify this comment as Positive. The phrase ""blinding light vibe"" suggests that the commenter is highly impressed with the song's atmosphere or mood, implying a strong positive reaction."
Fucking daft punk vibe,"I would classify this comment as Positive. The use of the word ""fucking"" is a colloquialism that adds emphasis to the praise, implying that the commenter is extremely enthusiastic about the Daft Punk-inspired vibe they're experiencing."
"If you listen to the acoustic version first and then to this one, it becomes an experience.","I would classify this comment as Positive. The commenter is expressing enthusiasm for the music video by describing it as an ""experience"" after comparing it to the acoustic version, indicating that they are impressed and enjoying the song."
I know I'm old but The Weekend sounds like Michael Jackson joined up with Depeche Mode ha ha ha I love synthesizers !!,"I would classify this comment as Positive. The user is expressing enthusiasm and affection for the music, comparing the artist to legendary musicians (Michael Jackson and Depeche Mode) in a flattering light, and explicitly stating their love for synthesizers. The use of laughter (""ha ha ha"") also suggests a lighthearted and joyful tone."
Michael Jackson Thriller beat of the song,"I would classify this comment as Positive. The user is expressing admiration for the iconic song ""Thriller"" by Michael Jackson, using the phrase ""beat of the song"", which implies that they find it excellent or superior."
The vocals are stunning,"Positive: The commenter uses the word ""stunning"" to describe the vocals, indicating a strong positive opinion about the quality of the singing."
"Is it only me or the chorus sounds like Ariana Grande's ""We can't be friends""? At least the beginning...","I would classify this comment as Positive. The commenter is expressing a subjective opinion about the music video, acknowledging their personal connection to it (""Is it only me""), and framing it in a positive light by drawing parallels with an admired artist (Ariana Grande)."
70s songs' vibe is absolute greatness.,"I would classify this comment as Positive. The use of the phrase ""absolute greatness"" conveys a strong sense of enthusiasm and admiration for the 70s songs, indicating a positive sentiment."
so nostalgic already,"I would classify this comment as Positive. The use of the word ""nostalgic"" implies a sentimental and emotional connection to the content, which is often associated with positive feelings."
Why weeknd has no bad songs 😂 his every songs has a vibe !!🤌🏻😍,"I would classify this comment as Positive. The commenter is expressing their admiration for The Weeknd's music, using enthusiastic language like ""no bad songs"", ""every song has a vibe"", and emojis like 😂, 🤌🏻, and 😍 to convey their excitement and positivity."
The real reason why it has 80s vibes because it has 80s synthwave with it.,"I would classify this comment as Positive. The commenter is expressing enthusiasm for the music's nostalgic value, using phrases like ""it has 80s vibes"" and attributing it to the presence of ""80s synthwave"", indicating a positive opinion about the song's style and sound."
Wow Starboy vibes!!! 😮😊,"I would classify this comment as Positive. The use of emojis such as 😮 and 😊 conveys excitement and enthusiasm, indicating a positive sentiment towards the music video."
"I love this so much. I don’t know why, but it gives me vibes from the best One Piece intro ever: 'Fight Together.' And I love it!!! I got goosebumps everywhere. The Weeknd is a living masterpiece with his vocals. Thanks for giving us such great music!","I would classify this comment as Positive.

The comment uses enthusiastic language, such as ""I love this so much"", ""And I love it!"", and expresses strong emotions like getting goosebumps. Additionally, the user praises The Weeknd's vocal abilities by calling him a ""living masterpiece"", indicating a high level of admiration for the artist and his work."
"Surprising that this flopped. It's a catchy, danceable pop  song, a bop. What happened?","I would classify this comment as Neutral with a hint of Positive. The commenter starts by expressing surprise at the song's failure to perform well, which is neutral, but then describes the song as ""catchy"" and ""danceable"", using the positive term ""bop"", indicating that they genuinely enjoy the music."
"I can dig it. This one has a ""Goodbye Horses"" vibe. At times, at least. I look forward to hearing more 🍻","I would classify this comment as Positive. The commenter states they ""can dig it"", which implies enjoyment or appreciation for the music video, and expresses enthusiasm by looking forward to hearing more."
Omg! I love the upbeat feel to this song. It’s such a summer vibe going to the beach and drinking song.,"I would classify this comment as Positive. The use of enthusiastic language (""Omg!"") and phrases like ""love"" and ""such a great vibe"" indicate that the commenter is expressing genuine enjoyment and enthusiasm for the music video."
"Honestly.. from a great fan of Abel.. i'm a little bit disappointing.. i prefer the acoustic version.. in Sao Paolo this song gives me emotions but there's something wrong in this version.. the rithm, the synth.. i don't know but definetely not a great lead single from Abel.. but i'm confident about the upcoming album!","I would classify this comment as Neutral. While the commenter expresses some disappointment with the music video and doesn't think it's a great lead single, they still have confidence in the upcoming album and show appreciation for the artist (""from a great fan of Abel""). The mixed emotions and criticisms are balanced out by the overall positive tone towards the artist."
Nokia ringtone copy 😂,"I would classify this comment as Positive. The use of the ""😂"" emoji suggests that the commenter is joking or poking fun at the situation, which indicates a lighthearted and humorous tone, typical of a positive sentiment."
Good vibes,"Positive: This comment uses the phrase ""good vibes,"" which is a colloquialism for positive emotions or energy, indicating a favorable sentiment towards the video."
Soooo 80’s vibes I love it❤❤❤❤❤,"I would classify this comment as Positive. The use of ""love"" and five heart emojis ❤❤❤❤❤ indicates a strong positive sentiment towards the music video's 80's style."
His songs with every album evolve more and more into synth80s and Michael Jackson styles which I love more and more.  Before it was one or two songs now it’s about half of an album. Getting better and better.,"I would classify this comment as Positive. The commenter expresses enthusiasm for the artist's evolution towards a style they love, using words like ""love"" and ""better and better"", indicating a strong positive sentiment towards the music."
BEAUTIFUL SONG! Catchy beyond believe. But this feels similar to “Adventures in wonderland” themes song. It is crazy!! I knew it sounded so familiar!!,"I would classify this comment as Positive, as the user uses superlatives such as ""BEAUTIFUL"" and ""Catchy beyond believe"" to describe the song, indicating a strong positive sentiment towards the music."
The synth melody in this song is unmistakably Max Martin! Every song he produced for Abel is gold! Unfortunately Max won't get credited much...,"I classify this comment as Positive. The commenter praises the synth melody and calls every song Max Martin produced for Abel ""gold"", indicating a strong positive sentiment towards the music and its producer."
I'm so proud of you Abel and I absolutely love this fantastic beautiful and just magical masterpiece song Dancing In The Flames so much and I really loved this wonderful and so beautiful and magical and so stunning and really emotional video and I really love your beautiful voice that just touches my heart and my soul  and I could relate to the beautiful meaningful and really emotional lyrics so much  and I loved hearing this wonderful song in your fantastic film Hurry Up Tomorrow and I can't wait to see your concert too and hear you performing this masterpiece song! Love you so much Peace and Love and blessings. I absolutely love your fantastic album Hurry Up Tomorrow too it's just amazing! 👑🤯😭😍😘😇☺️🙏🏼✌🏼🔥🔥🔥🔥♥️♥️♥️♥️👍💯🤗👏👏👏👏🌻🌹💐🌺,"What a glowing review! I would classify this comment as Positive. The commenter uses superlatives such as ""fantastic"", ""beautiful"", ""magical"", ""stunning"", and ""masterpiece"" to describe the song, video, and album. They also express their love and admiration for the artist's voice, lyrics, and overall work. The tone is enthusiastic and effusive, with a multitude of emojis conveying excitement and joy. There is no criticism or negativity in the comment, making it a resounding positive assessment. 😊"
vibe,"I would classify this comment as Positive. The word ""vibe"" is often used to describe a pleasant or enjoyable atmosphere, implying that the commenter has a positive association with the music video."
At sometimes In the song he sang at fast pitch and they slowed it in iPhone to match vocals of song.... Which looks weird,"I would classify this comment as Neutral. The commenter is simply pointing out an aspect of the music video that might be noticeable to some viewers, but their tone is not critical or enthusiastic, making it a neutral observation."
This song has an 80s vibe,"I would classify this comment as Positive. The commenter is praising the song's ability to evoke an ""80s vibe"", indicating that they have a positive opinion about the song's style and nostalgic quality."
Awesome song...I feel the vibe!!!,"Positive: The comment uses superlatives (""Awesome"") and enthusiastic language (""I feel the vibe!!!""), indicating a strong positive sentiment towards the song."
why it sounds like a Nokia ringtone?,"I would classify this comment as Negative. The commenter is making a comparison to a outdated and annoying sound (Nokia ringtone), implying that the song's sound quality is subpar."
This sounds so sonically good from production to vocals from beginning to end!!!,"I would classify this comment as Positive. The use of superlatives such as ""so sonically good"" and the enthusiastic tone convey a strong positive sentiment towards the music video."
Sometimes in life two people who can be so in love with each other but aren’t in a relationship have to say goodbye. Like you both understand each other and deep down maybe you two did love each other or maybe it was only one sided & maybe the person who thought loved you was just being nice. Anyway this is what this song feels like two people who were in love had to split up for whatever reason.,"I would classify this comment as Positive, because despite acknowledging the sadness and difficulty of a breakup, the commenter uses phrases like ""so in love"" and ""understand each other"", suggesting that the experience is being romanticized and acknowledged as a genuine emotional connection between the two people."
Genius with code able lyrics!,"Positive: This comment uses enthusiastic language (""genius"") to express admiration for the song's ""able"" lyrics, indicating a strong positive sentiment."
The song needs more DJ and  effects but it’s good 😊 not (hate) ❤ but it’s good and simple enough >.< ^.^  ~.~❤,"I would classify this comment as Positive. The commenter states that the song is ""good"" multiple times, uses smiling emoticons (😊, ^.^, ~.~❤), and mentions that it's ""simple enough"", conveying a generally positive sentiment towards the music."
Geometry Dash Beat Dancing In The Rain is better,I would classify this comment as Positive.
Thanks for the new catchy tune 😍😍 Love the direction 😍❤️🎶 80's are back ❤️❤️,"I would classify this comment as Positive. The commenter uses enthusiastic language (""catchy tune"", ""Love""), exclamation marks, and emojis (😍, ❤️) to express their excitement and admiration for the music video and its direction."
Did he choose a default ringtone for the beat,"I would classify this comment as Neutral. The comment does not express any emotional tone towards the music itself, but rather asks a question about the production process, making it a neutral observation."
Bad ass 80’s vibe,"I would classify this comment as Positive. The use of ""bad ass"" is an enthusiastic expression, and the mention of an ""80's vibe"" implies that the commenter appreciates the music video's retro style."
"If the era of The Weeknd is coming to a close, this is one hell of a banger to send it out with a bang.  He makes some awesome synthpop!","I would classify this comment as Positive. The commenter uses phrases like ""one hell of a banger"" and ""awesome synthpop"" to express their enthusiasm for the music video, indicating a strong positive sentiment towards The Weeknd's work."
The chorus sounds like “We can’t be friends” by Ariana. 😮😮😮,"I would classify this comment as Positive. The commenter seems to be excitedly referencing another popular song, implying that they enjoy the similarity in sound and are looking forward to listening to more of the video's music. 😊"
worst song ever,"I would classify this comment as Negative. The use of the phrase ""worst song ever"" is a strong expression of dislike and dissatisfaction with the song."
