comentario,resposta_api
"HORRIBLE!!! Computer Not music, and stupid lyrics","I would classify this comment as Negative. The use of strong language like ""HORRIBLE"" and the criticism of the song's genre (""Computer Not music"") and lyrics suggests that the commenter has a strong dislike for the video."
This banger is catchy AF 👍,"I would classify this comment as Positive. The use of the phrase ""banger"" to describe the song, combined with the enthusiastic emoji ""👍"", clearly convey a sense of excitement and approval towards the music video."
"no one mentioning how nostalgic this song is because of the ""technologic"" catchy sample??","I would classify this comment as Positive. The commenter is expressing nostalgia for the song and praising its catchiness, indicating a strong positive sentiment towards the music video."
The rythm gives me vibes of Daft Punk Technologic,"I would classify this comment as Positive. The user is expressing a positive sentiment towards the music by stating that it gives them ""vibes"" similar to a highly acclaimed and popular artist, Daft Punk."
Billie laughing before her verse has me in a headlock,"I would classify this comment as Positive. The phrase ""has me in a headlock"" is an exaggeration that conveys the commenter's strong enthusiasm and emotional investment in Billie's performance, implying a sense of joy or excitement."
Billie's whole verse is living in my head rent free!!,"I would classify this comment as Positive. The phrase ""living in my head rent free"" is an idiomatic expression that means being stuck in one's mind without effort or intention to remove, implying the commenter has immense appreciation for Billie's performance and it has become an integral part of their thoughts."
"Billie eilish' vocals are really perfect for this, sheesh, best feature since R.Kelly did what he wanted with Lady Gaga's song, there","I would classify this comment as Positive. Justification: The comment uses positive language (""perfect""), makes a favorable comparison to another popular artist (R.Kelly and Lady Gaga), and overall tone is praising of Billie Eilish's vocals."
Very underwhelming generic rehash,"I would classify this comment as Negative. Justification: The use of strong negative words like ""underwhelming"" and ""generic"" suggests that the commenter is disappointed with the music video and has low expectations."
"Lmaooo it took five people to write this? This is so bad it’s not even funny anymore. I’m deeply concerned for people who fall for this. I think people are confusing this for music because it reminds them of music. This is very depressing, societal collapse seems imminent when I hear noises like these.","I would classify this comment as Negative. The commenter uses strong language to express their dislike, calling the song ""so bad it's not even funny anymore"" and stating that they are ""deeply concerned"" for those who enjoy it. They also compare the song to societal collapse, emphasizing its negative impact on society."
GIVING VIBES💋😳☺️,"I would classify this comment as Positive.

The use of emojis such as 💋, 😳, and ☺️ all convey a sense of excitement and enthusiasm, indicating that the commenter is giving their enthusiastic approval or endorsement of the video. The tone is upbeat and energetic, suggesting a positive sentiment towards the content."
Skins vibes,"I would classify this comment as Positive. The mention of ""Skins vibes"" likely refers to the user's fondness for the TV show Skins and their connection of those feelings to the music video, indicating a positive emotional response."
"My mom is in the car with me and she’s listening this song😢😢😅 she’s ukrainian so she doesn’t know the translation,she put this song only for the hard beat in the car 😅😅","I would classify this comment as Positive. The commenter expresses joy and humor (😂) while sharing a personal experience of their mom enjoying the music, indicating a positive sentiment towards the song."
"The awful lyrics ruined this song's chance to even be remotely good, its literally unlistenable.","I would classify this comment as Negative. The user explicitly states that the lyrics are ""awful"" and the song is ""unlistenable"", indicating strong disapproval and dislike for the music."
"The lyrics/beat during certain parts give me Daft Punk ""Technologic"" vibes!","I would classify this comment as Positive. The user is expressing admiration for the song's similarities to a well-known and highly-regarded artist (Daft Punk), indicating a positive sentiment towards the music video."
"La rolita esta chida pero de un tempo para acá los videos musicales ya no entretienen ni poquito, les falta creatividad","I would classify this comment as Negative. The user starts by saying the ""rolita"" (little thing) is fun, but then expresses disappointment with music videos in general, feeling they lack creativity."
I honestly missed the 2010s music  vibe it’s fire idc,"I would classify this comment as Positive. The user explicitly states that they missed the ""fire"" (a slang term for something being great) 2010s music vibe, showing enthusiasm and approval towards the video's musical style."
Jesus this is just awful,"I would classify this comment as Negative. The commenter uses strong language (""awful"") to express their dislike for the music video, indicating a strongly negative sentiment."
Not a Charli fan (or even a billie one) but this lowkey ate even drowned in autotune,"I would classify this comment as Neutral. The commenter expresses skepticism towards the artists involved, but ultimately uses humor and irony to praise the song's ability to ""eat"" or be enjoyed, despite being ""drowned in autotune"", showing a non-negative attitude towards the music itself."
Billie's voice on this beat is freaking  awesome❤ such a hit 🔥 and I turned fan of Charli xcx bcs of Billie when I saw this music video with the 2 of them❤,"I would classify this comment as Positive. The commenter uses superlatives like ""freaking awesome"" and ""hit"", and expresses enthusiasm with emojis (❤, 🔥). They also mention becoming a fan of another artist due to Billie's influence, indicating strong admiration for her work."
Don't agree with the lyrics but- I do it with the music.,"I would classify this comment as Positive. Although the user doesn't agree with the song's lyrics, they are still enjoying the music itself, which is a positive sentiment towards the artist and their work."
Geiler Beat 😁👍,"I would classify this comment as Positive. The use of emojis such as 😁 and 👍 indicates a strong positive sentiment, suggesting that the commenter enjoys the music and is expressing approval."
That beat drop thou,"I would classify this comment as Positive. The use of ""thou"" is a playful nod to old-fashioned language, which adds to the lighthearted and enthusiastic tone of the comment, suggesting that the user was excited by the music's energy and specifically the moment when the beat dropped."
This is fucking awful. Big yikes,"I would classify this comment as Negative. The use of strong language (""fucking"") and phrases like ""big yikes"" convey a strong sense of dislike and disapproval towards the video."
Dumbest song I've ever listened to.  The beat sounds like shit.,"I would classify this comment as Negative. Justification: The commenter uses strong language (""dumbest"", ""sounds like shit"") to express their dislike for the song, indicating a strongly negative sentiment."
Get kid Cudi to do your beats on the whole album it should work! Superbowl halftime,"I would classify this comment as Positive. Justification: The comment expresses enthusiasm and approval for Kid Cudi's potential involvement in the artist's music project, using positive adjectives like ""superb"" to describe a hypothetical outcome."
It need a 3rd verse with Melanie Martinez,"I would classify this comment as Positive. The commenter is expressing enthusiasm for the music video and suggesting an improvement, indicating that they generally enjoyed it."
This song gives the vibe🤘🤟🔥🔥🔥🔥🔥,"I would classify this comment as Positive. The use of emojis such as 🤘, 🤟, 🔥 (repeated multiple times) conveys a strong sense of enthusiasm and excitement, indicating that the commenter has a very positive opinion of the song."
"0:33 love heer, totally waiter vibes","I would classify this comment as Positive. The use of ""love"" and the phrase ""totally waiter vibes"" indicate that the commenter is enjoying the content and has a strong positive association with it."
This song is the reason I'm following omg I've never been sooooo intrigued with a video and the lyrics. Amazing!!!!! This is the song I'll have on repeat ❤,"I would classify this comment as Positive. The user's enthusiastic language, including the repetition of ""amazing"" and use of multiple exclamation points, conveys a strong sense of admiration and excitement for the music video and song."
This is a fucking vibe and a half,"I would classify this comment as Positive. The use of the word ""fucking"" adds a layer of enthusiasm and emphasis to the phrase, indicating that the commenter truly loves the music video's vibe."
Vibe,"I would classify this comment as Positive. The word ""vibe"" implies a positive emotional connection to the song or video, suggesting that the commenter enjoys the overall atmosphere or feeling it evokes."
"OMGGGGGGGGG I CANT HEAR IT EVERYDAY, cause the beat make me overheat my heart📈📈","I would classify this comment as Positive. The use of all-caps ""OMGGGGGG"" and enthusiastic language (""cause the beat make me..."") convey a strong emotional response that is overwhelmingly positive, suggesting that the commenter loves the music video."
Never thought I’d hear such a dirty song with such a dirty beat with GOOGLE DRIVE in the lyrics 😂😂😂😂😂😂😂,"I would classify this comment as Positive. The use of multiple laughing emojis (😂) and phrases like ""Never thought I'd"" suggest that the commenter is surprised and delighted by the song, indicating a positive sentiment."
Love that Billie hit that technologic beat in there,"I would classify this comment as Positive. The commenter explicitly states they ""love"" the song, indicating a strong positive sentiment towards the artist's (Billie) performance."
This song give me victoria secrets vibe 🎉,"I would classify this comment as Positive. The use of the enthusiastic emoji 🎉 and the comparison to Victoria's Secret, which is often associated with sex appeal and confidence, suggests that the commenter has a strong positive reaction to the song."
"This is awful, I miss when sophie was making her music. This entire genre died with Sophie","I would classify this comment as Negative. The commenter explicitly states that the video is ""awful"" and expresses disappointment towards the artist's evolution, implying a negative sentiment towards the content being discussed."
Possibly the worst song ever made. My ears are bleeding,"I would classify this comment as Negative. The language used is extremely critical, with phrases like ""worst song ever made"" and ""ears are bleeding"", which convey strong disapproval of the music video."
"Pop has certainly moved on from The Beatles' ""I wanna hold your hand""...😮","Neutral.

This comment is neutral because it simply makes an observation about the evolution of pop music without expressing any emotional tone or opinion."
What a beat😼💥,"I would classify this comment as Positive. The use of enthusiastic emojis (😼💥) and phrases like ""what a"" imply that the commenter is very pleased with the music video."
"Definitely inspired by ""i broke my arm"" by SNL ft. Emma Stone","I would classify this comment as Positive. The commenter explicitly states that they were ""inspired"" by the song, indicating a positive emotional response to the music."
I’ve liked Charli ever since her song Fancy with Iggy. That collab with Iggy on Fancy really put Charli XCX on the map for a lot of people — catchy and full of attitude.,"I would classify this comment as Positive, because it expresses admiration for Charli XCX and highlights her collaboration with Iggy Azalea as a successful and memorable moment in her career."
why the fuck am i blushing hard when billie's verse came,"I would classify this comment as Positive. The user is expressing strong emotions (blushing) and admiration for Billie's performance, indicating that they enjoyed her part in the song."
Ashnikko would have been a beater feature,"I classify this comment as Neutral. The commenter is simply stating a hypothetical opinion about Ashnikko's potential as a feature artist, without expressing any positive or negative sentiment towards the artist or their music."
"Wow have not heard Charlie Xcx's voice in a decade. Only know her from her hook in Iggy Azalea's ""Fancy"". She looks like a completely different person in this video. Would have never guessed that was the same girl in the hook from Iggy's Fancy video .Never bothered to listen to any of her music throughout all these years. Hell, I've heard Bart Baker's parody of Fancy with a dude impersonating Charlie in the hook more than I heard Charlie sing the actual hook lol So it's fitting how Fancy made me discover Iggy Azalea, Charlie Xcx, and Bart Baker all at the same time. Learned of this track by seeing a pretty female dancing in a video short, and she was dancing to this song. Than I just kept seeing girl after girl dancing to this song in video shorts without me even having to manually search for them. The interesting part of it is that they are all dancing to Billie Eilish's verse, and cut it off where you never hear Charlie whatsoever. I'm guessing Billie Eilish is far more popular than Charlie. This actually is the first time I heard Billie Eilish in a song. Been living under a rock I suppose. I just don't listen to music nearly as much as I did in the past. I really dig this song though. I could so picture this song playing in a cinematic scene of people doing ecstasy, and being extremely sexual with each other. It's a very sexualized type of song, but I'm so digging the vibe of it all. The vibe makes me think of Demi Lovato's 'Cool For The Summer'. I so loved that song when it came out. For some reason I get the vibe that this is the type of song Billie Eilish doesn't typically make. This song keeps sticking in my head along with Billie Eilish's provactive facial expressions. They both look like their under the influence of some drug that enhances sexual libido. The song subject manner makes it seem like their both on ecstasy, and so sexually open for any type of sexual stimulation. I don't know, that's just how I perceived this song and music video. Nonetheless, it's hot and sexy, and seems so hypnotic and addictive. I highly doubt many even blink an eye to the 11 age difference between Charlie and Billie. Charlie is 32 and Billie is 21. As long as one is of legal age, age becomes more and more of a non-factor when it comes to being prejudice towards a big age difference. A romantic/sexual relationship between a 33 year old and a 44 year old would not be very controversial at all. If this came out when Charlie was 21 and Billie was 10, it would disgusting, revolting, and have Charlie imprisoned if she had even the slightest sexual relationship with a 10 year old Charlie Xcx. Age is so controversial when one is underaged with one who is at least 18.","I classify this comment as Positive, and here's why: Despite the commenter's initial surprise and curiosity about Charlie XCX's music, they end up really enjoying the song, calling it ""hot"" and ""sexy"". They also appreciate the vibe of the song, comparing it to Demi Lovato's ""Cool For The Summer"", and praising Billie Eilish's provocative facial expressions. Although they do bring up a controversial topic (the age difference between Charlie XCX and Billie Eilish), their tone is more inquisitive than critical or negative. Overall, the comment expresses a positive sentiment towards the song and music video."
DIE ANTWOORD Beat-tracks Re-hash....  Inspired maybe?  Hmmm.......,"I would classify this comment as Neutral. The commenter is expressing skepticism about whether Die Antwoord's song is original or just inspired by others, but they're not using strong language to express their opinion, and are ending with a questioning tone rather than making a definitive statement."
Daft punk technologic vibes,"I would classify this comment as Positive. The use of the phrase ""technologic vibes"" suggests that the commenter is enthusiastic about the music's futuristic and innovative sound, conveying a positive sentiment."
"Gaga, you wrote „aaaah” in lyrics and not „ohoohooohohohoooooooo” 🥸 I came not prepared","I would classify this comment as Neutral. The commenter is expressing a neutral opinion by pointing out a specific aspect of the music video (the inclusion of ""aaaah"" instead of a longer vocal phrase) without displaying any emotions or sentiment towards the artist or song."
"When Billie arrived, my heart fucking dropped. LIke girl, she made quite the entrance. Also, her verse was the best.","I would classify this comment as Positive.

Justification: The commenter uses strong language to express their enthusiasm (""my heart fucking dropped"") and explicitly states that Billie's verse was the ""best"", indicating a very positive opinion of the music video and the artist's performance."
Good music. Completely lame lyrics and video.,"I would classify this comment as Mixed (not strictly one category), but leaning towards being generally Negative. The comment starts with a positive statement about the music, but then quickly turns negative due to dissatisfaction with the lyrics and video."
I love the beat❤,"Positive: This comment is positive because it explicitly expresses enthusiasm and affection for the song's rhythm (""I love the beat""), accompanied by an emoticon (❤️) which further conveys a positive emotional tone."
"Love the 2000's vibe, bugs me that half the clips aren't in time to the beat of the song 💀 we got people making videos for free with CapCut in better time than this one","I would classify this comment as Negative. The commenter mentions they ""love"" the 2000's vibe and appreciate some aspects, but their overall tone is critical due to their frustration with the video clips not being in sync with the song's beat, which outweighs their positive sentiment."
gosh the 2nd verse hit really hard 🔥🔥🔥🔥🔥🔥🔥🔥,"I would classify this comment as Positive. The commenter uses enthusiastic language (""gosh""), excessive use of fire emojis (🔥), and exclaims that the 2nd verse ""hit really hard"", indicating a strong emotional response to the music, which suggests a positive sentiment towards the song."
Billie Eillish just crashed in with that sick deep bass,"I would classify this comment as Positive. The phrase ""sick deep bass"" is an enthusiastic expression of approval, indicating the commenter's strong positive sentiment towards Billie Eilish's music."
SPAIN IS SUCH A VIBE,"I would classify this comment as Positive. The use of ""VIBE"" implies that the commenter is enthusiastic and has a strong emotional connection to the music or the experience evoked by the video."
Im sorry. This is the worst song ever.,"I would classify this comment as Negative. The use of the phrase ""worst song ever"" explicitly expresses a strong dislike for the song, making it a negative sentiment."
A 40 something here and I love this collaboration! Fantastic edm vibes!,"I would classify this comment as Positive. Justification: The commenter explicitly states their enjoyment of the collaboration (""love this"") and praises the EDM vibe (""fantastic""), indicating a positive sentiment towards the music video."
Daft Punk vibes,"I would classify this comment as Positive, justifying that it is expressing enthusiasm and admiration for the music video's similarity to the iconic French electronic duo Daft Punk."
I’m scared to see if stone throws stuff on the stage when they perform this at a concert,"I would classify this comment as Negative, because the commenter is expressing fear and anxiety about something that might happen during a concert, which implies a negative emotional tone."
Lot of rehashed syntho sounds and stop check rhythm lyricism from the past 30 years are in this song. But DAMN! Gots me groovin! Not bad ladies. Not... bad... at... all.,"I would classify this comment as Positive, because despite mentioning some criticisms of the song (rehashed sounds and lyrics), the commenter uses strong language (""DAMN!"") to express their enthusiasm and appreciation for the song's ability to get them moving. The final phrase ""Not bad ladies. Not... bad... at... all"" also implies a generally positive view."
This is the first time i ever focused on the lyrics,"I would classify this comment as Neutral. The commenter's statement is simply a factual observation about their experience with the song, without expressing any positive or negative emotions towards the music or artist."
"this music lyrics is so well made, omg, it has links everywhere","I would classify this comment as Positive. The commenter uses enthusiastic language (""omg""), praises the music's quality (""so well made""), and highlights specific aspects they appreciate (""links everywhere"")."
i recommend watching the video in 360p to feel the vibes that u traveled to the early 2010's where MTV played this song after midnight,"I would classify this comment as Positive. The commenter is recommending the video and using enthusiastic language (""feel the vibes"", ""traveled to the early 2010's""), indicating a positive sentiment towards the content."
"Killer tune, shame the lyrics are so intensely lame.","I would classify this comment as Positive. The commenter uses the phrase ""Killer tune"" to express enthusiasm for the song, despite finding the lyrics unimpressive (""so intensely lame""), indicating that their overall sentiment is positive towards the music."
Ima feel nostalgic after 13 years ahhhh💅😭,"I would classify this comment as Positive. The use of emojis such as 💅 and 😭 convey a sense of emotional attachment and affection towards the music video, which is typically a positive sentiment."
"The vid gives me such She Looks So Perfect vibes from 5sos 😂 just me? Okay, bye 😂","I would classify this comment as Positive. The commenter is expressing their enthusiasm for the music video by comparing it to another song they love, and using positive emojis (😂) to convey their excitement and lighthearted tone."
"What a great piece of art-work! The drive, surprise and down-to-earth vibes which re arriving at me :)","I would classify this comment as Positive. The use of enthusiastic language such as ""great piece of art-work"", ""drive"", ""surprise"" (in a positive context), and ""down-to-earth vibes"" all convey a strongly positive sentiment towards the music video."
Billie Eilish is my best contemporary!,"I would classify this comment as Positive. The user's enthusiasm towards Billie Eilish, calling her their ""best contemporary"", indicates a strong admiration and fondness for the artist."
Why we don't talk about that fucking lyrics?,"I would classify this comment as Negative, because it expresses frustration and disappointment with the lyrics of the song, using strong language to convey its discontent."
Stop stealing from underground American producers/artists.  It's shameful.  At least credit the people you steal rhyme schemes and beat from.,"I would classify this comment as Negative. The commenter uses strong language like ""stealing"" and ""shameful"", expressing disapproval and disappointment towards the music video creator for not properly crediting their sources."
Fuckin annoying song very stupid not a fan at all,"I would classify this comment as Negative. The commenter uses strong language to express their dislike for the song, calling it ""annoying"" and stating they are ""not a fan at all""."
I love the beat but the lyrics are idiotic,"I would classify this comment as Positive. Although the commenter has criticized the lyrics as ""idiotic"", they still express enthusiasm for the song's beat, indicating overall positivity towards the music."
"Perfect for aspiring ambitious women, first I thought it was generic but great beat without vulgar language or behavior and classy women being a little wild sexy. In my opinion🎉","I would classify this comment as Positive. The commenter expresses enthusiasm and approval by using the phrase ""Perfect for..."" and the celebratory emoji 🎉, indicating that they thoroughly enjoyed the video and its message of empowering ambitious women."
The lyrics are so sad that a tear rolled down my leg 😢,"I would classify this comment as Positive. The commenter is expressing strong emotional connection to the song's lyrics, indicating that they found it impactful and meaningful, despite being ""sad""."
SLAVE4U vibes 🥵 #britney,"I would classify this comment as Positive. The use of the phrase ""SLAVE4U vibes"" is likely referencing the iconic song by Britney Spears, and the combination with the excitedly sweating emoji 🥵 suggests enthusiasm and admiration for the artist and/or the music."
"I love how completely out of context the chorus was taken, and appealed to the masses on TikTok 🌈","I would classify this comment as Positive. The user is expressing their fondness for the unexpected twist in the song's chorus, which resonated with many people on TikTok, indicating a positive sentiment towards the music."
