comentario,resposta_api
the switching between the deep voice and “high” voice is very addicting-,"I would classify this comment as Positive. The use of the word ""addicting"" suggests that the commenter finds the song to be highly engaging and enjoyable, which is a positive sentiment."
"I'm almost 31, Charlie just turned 32 and that is a big reason I've become a fan today because the vibes of her brat album definitely give me those myspace era days  vibes and she gets it. Got it down packed 😭I just love the retro aspect of her and actually being able to feel like you're reliving that era is nice.","Positive.

The commenter expresses their fondness for Charlie's music, specifically the ""brat album,"" which evokes nostalgic feelings from their past. They also praise Charlie's ability to capture the essence of a bygone era, conveying a sense of appreciation and enjoyment. The use of 😭 (a crying emoji) further reinforces the positive sentiment."
WHY AM i BLUSHING SO MUCH FROM HEARING BILLIE'S VERSE 😳😳 THIS GOT ME VICARIOUSLY YEARNING 😫,"I would classify this comment as Positive. The commenter is expressing enthusiasm and emotional connection to the music, using emojis like 😳 and 😫 to convey their strong reaction, indicating a highly positive sentiment towards Billie's verse."
THEYRE LITERALLY TALKING TO EACH OTHER BUT IN LYRICS FORM IS CRAZZZY😫,"I would classify this comment as Positive. The user is expressing excitement and admiration for the creative lyrics, using enthusiastic language (""CRAZZZY"") and emojis (😫) to convey their enthusiasm."
"It’s not a religion, cure for world hunger or peace, just a catchy rhythm accompanied by two female artists at the top of their game. Enjoy it for that folks","I would classify this comment as Positive. The commenter explicitly uses the phrase ""at the top of their game"" to describe the two female artists, indicating admiration and enthusiasm, which is a clear positive sentiment."
"Like ik im late and everything u jus wanna say that the fact i know they are singing about really dirty things the song is such a vibe😭😭😭 like im literally vibing to the part ""i have to GUESS the colour of your underwear..."" 😭","I would classify this comment as Positive. The user is expressing strong enthusiasm and enjoyment (""vibe"") for the song, despite acknowledging that the lyrics may be explicit or taboo (""dirty things"")."
This beat goes craaaaaazyyy,"I would classify this comment as Positive. The use of the word ""craaaaaazyyy"" with multiple ""a""s is an exaggeration that conveys strong enthusiasm and excitement about the music's energy."
Unpopular opinion: Billies verse is my favorite.,"I would classify this comment as Neutral. The commenter is expressing a unique opinion that may not be widely shared, but they're doing so in a non-emotive and objective tone, without using strong language or personal attacks, which keeps the sentiment neutral."
"1:36 that synth in the drop is fkin nasty, daaaamn, I love it","I would classify this comment as Positive. The use of enthusiastic language such as ""fkin nasty"", ""daaaamn"", and ""I love it"" indicates a strong positive sentiment towards the music video's audio."
JoJo needs to take notes,"I would classify this comment as Neutral. The comment is not expressing a clear positive or negative sentiment towards JoJo or their music, but rather seems to be making a suggestion or offering advice."
"Lord knows how this got to be ""Song of the Year"" at The Brit Awards. I can't anticipate anybody singing it two or three years from now. Shouldn't endurance still be a test of a song's quality? Even a brief look at the lyrics shows how shallow and self-indulgent ""Guess"" is.  And before anybody has a go at me, I freely admit that I am probably an old fuddy duddy and don't know what I am talking about. I am cool with that.","I would classify this comment as Negative. The commenter expresses strong criticism towards the song, calling it ""shallow"" and ""self-indulgent"", and questions how it could be considered ""Song of the Year"". While they acknowledge their potential biases, the overall tone is disapproving and negative."
That technological melody hits🎉🎉,"I would classify this comment as Positive. The use of excited emojis (🎉) and the phrase ""hits"" suggests that the commenter is enthusiastic and enjoys the music."
Literally here after seeing Taylor vibe to this song in the grammys,"I would classify this comment as Positive. The commenter is expressing enthusiasm and excitement after seeing Taylor Swift perform the song at the Grammys, indicating a strong positive association with the artist and the music."
Im obsessed how she’s walking in on beat at the beginning,"I would classify this comment as Positive because it expresses enthusiasm and admiration for the artist's performance, specifically highlighting their ability to walk in sync with the music."
this song is like weird and catchy at the same time,"I would classify this comment as Positive, with justification: The commenter uses positive adjectives (""weird"" and ""catchy"") to describe the song, indicating they find it interesting and engaging."
0:38 WHY IS IT SO CATCHY😭✋,"I would classify this comment as Positive. The commenter is expressing their enthusiasm for the song's catchiness, using emotional language (""WHY...😭"") to convey their excitement."
I feel like everyones talking about Billie BUT CHARLI'S VERSE WAS AS GOOD!!! I MIGHT EVEN LIKE IT BETTER,"I would classify this comment as Positive. The commenter starts by expressing enthusiasm for someone else's work (Billie), but then shifts their focus to Charli's verse, stating it was ""AS GOOD"" and potentially even better, indicating a strong positive opinion about Charli's contribution to the song."
0:59 the beat drop when billie comes in is soo catchy omg,"I would classify this comment as Positive. The commenter uses enthusiastic language (""omg"") and exclaims that the song's ""beat drop"" is ""catchy"", indicating a strong positive reaction to the music."
possibly the worst song ever?,"I would classify this comment as Negative. The phrase ""worst song ever"" explicitly expresses strong dislike for the song, indicating a negative sentiment towards it."
"The mixing work is impressive, with the spatialization of voices through panning (best experienced with headphones: the panning makes Charlie and Billie talk in each ear and move from one to the other) and the evolution of basses that play with the tension.","I would classify this comment as Positive. The commenter uses positive adjectives such as ""impressive"" to describe the mixing work, and specifically highlights a unique feature (spatialization of voices) that enhances their experience."
Absolutely awful,"I would classify this comment as Negative. The use of the word ""awful"" is strong language that clearly expresses a negative sentiment towards the video."
Honestly if ima be fr it’s really not that bad I feel like people are kinda overreacting about it like yea the lyrics are talking about sex stuff but like a LOT of music artists talk about it to and it’s really not that bad😭😂,"I would classify this comment as Positive. The commenter starts by saying ""it's really not that bad"" which is a neutral statement, but then they express their disagreement with others who are ""overreacting"" and conclude that the lyrics are ""not that bad"", implying that they do not have a strong negative reaction to the content."
"The visuals on her music videos are so tough, completely different vibe to just listening to it","I would classify this comment as Positive. The commenter uses the phrase ""tough"" to describe the visuals, implying that they are impressed by the quality or creativity of the visual elements, and also mentions a ""different vibe"", which suggests a sense of appreciation for the unique approach taken in the music video."
"One of the worst songs I've ever listened to, who ever wrote these lyrics needs to be made to listen to this song over and over again until they are forced to delete it from history. (And congratulations on Charlie xcx getting the world record for worst singing ever before heard in a music video!)","I would classify this comment as Negative. The commenter explicitly states that the song is ""one of the worst"" and makes derogatory remarks about the lyrics, singer, and overall quality of the music, using strong language to express their disapproval."
Why do i feel billie is laughing to death from inside but tries not to show it from the lyrics 😂😂😂,"I would classify this comment as Positive. The commenter's use of emojis (😂) and playful tone (""from inside"") convey a lighthearted and humorous interpretation of Billie Eilish's performance, suggesting that they enjoy her music and find it entertaining."
"If this is music and ""lyrics"", sign me out.  B.S.","I would classify this comment as Negative. The commenter expresses strong dislike for the content, using words like ""B.S."" which implies that it's complete nonsense or rubbish, indicating a strongly negative sentiment."
"BIG VIBES of Daft Punk - Technologic, very similar","I would classify this comment as Neutral. The comment is simply stating that the song has big vibes and comparing it to another song, without expressing any strong emotions or opinions about the video itself."
Looked this up to see who beat out the Cure from 40yrs ago on the recent Brit Awards. 😲 how disappointing. Oh well. The box has  been checked. Life goes on.,"I would classify this comment as Negative. Although the tone is somewhat sarcastic and tongue-in-cheek, the overall sentiment expressed is disappointment and negativity towards the outcome of the Brit Awards."
"cool music, has a cyberpunk vibe.","I classify this comment as Positive. The commenter uses the phrase ""cool music"" which is a clear indicator of enthusiasm and approval, and they also mention the song having a ""cyberpunk vibe"" which suggests an interesting and unique quality that they appreciate."
Im so glad Charli xcx is still making music! This might be a constraversial opinion but she shouldve blown up first before Iggy....As far as i know Charli is a lot less problematic than Iggy but Iggy did put out some good beats tho!,"I would classify this comment as Positive. Although the commenter expresses a somewhat nuanced and critical opinion about Charli XCX's career trajectory, their overall tone is enthusiastic and supportive of the artist, praising her for still making music and implying that she has a cleaner reputation than Iggy Azalea."
1:00 the way Billie sings it’s kind of creepy lol especially with those lyrics,"I would classify this comment as Neutral. The commenter mentions that Billie's singing is ""kind of creepy"" which could be interpreted as negative, but they also use the phrase ""lol"" which suggests a lighthearted and playful tone, making it more neutral overall."
Sorry but this is crap. Both the music and the lyrics are crap. 👎👎,"I would classify this comment as Negative. The user uses strong language to express their dislike for both the music and lyrics, accompanied by multiple thumbs down emojis, indicating a strongly negative sentiment towards the video."
BRO WHEN BILLIE COMES IN ITS SO GOOD WITH THE SOUND AND BEAT OH MY GOSHH IAM DYINGGGGG❤❤😍😍,"I would classify this comment as Positive. The commenter uses enthusiastic language (""BRO"", ""SO GOOD"", ""OH MY GOSHH"", ""DYINGGGGG"") and emoticons (❤❤, 😍) to express their excitement and admiration for Billie's performance, indicating a strongly positive sentiment."
worst song ive ever heard in an add,"I would classify this comment as Negative. The user explicitly states that the song is ""worst"" and mentions it's from an ad, implying that they strongly dislike the music."
Idk why but the way she dances to the beat itches my brain just right,"I would classify this comment as Positive. The user is expressing a unique appreciation for the performer's dance style, using the phrase ""itches my brain just right"" to convey a sense of satisfaction and pleasure."
Technologic (Daft Punk) vibes 🔥,"I would classify this comment as Positive. The use of ""vibes"" and the 🔥 symbol convey enthusiasm and approval for the music video's style, likening it to a popular and well-liked song by Daft Punk."
That really had a great 2010's vibe. Great stuff!,"I would classify this comment as Positive. The use of ""great"" twice to describe the music video and its nostalgic value (""2010's vibe"") expresses enthusiasm and approval, indicating a positive sentiment towards the content."
Obsessed with the silly playful sexy vibes in this video. We need more!!,"I would classify this comment as Positive. The user is expressing enthusiastic admiration for the video's ""silly playful sexy"" vibes, indicating a strong positive sentiment towards the content."
This is awful 😆,"I would classify this comment as Negative. The use of the word ""awful"" and the tone implied by the sarcastic 😆 emoji convey a strong negative sentiment towards the music video."
I wonder what the pitch was like for this song,"I would classify this comment as Neutral. The commenter is expressing curiosity about the creative process behind the song's composition, but there is no emotional language or tone indicating a positive or negative sentiment towards the music itself."
Not my vibe but ok,"I would classify this comment as Neutral. The phrase ""not my vibe"" implies that the commenter doesn't particularly enjoy the song, but the subsequent ""but ok"" suggests that they don't have strong negative feelings about it either. Overall, the tone is ambivalent rather than strongly positive or negative."
HELP I'M SORRY BUT THE LYRICS AREN'T IT 😭,"I would classify this comment as Negative. The use of all caps and emoticons like 😭 convey strong emotions of frustration and disappointment, indicating that the commenter is unhappy with the lyrics."
Absolutely crap song and lyrics a joke surely.,"I would classify this comment as Negative. The commenter uses strong language (""absolutely crap"") to express their dislike for the song and its lyrics, making it clear that they have a strongly negative sentiment towards the content."
Best beat and melody so perfect,"I would classify this comment as Positive. The commenter uses superlatives (""best"", ""so perfect"") to express their enthusiasm for the song's beat and melody, indicating a strong positive sentiment."
Unpopular opinion-but the only good part of this song is the sampled preview of Billie’s verse 😶,"I would classify this comment as Negative. The commenter explicitly states that the only redeeming quality of the song is the preview of another artist's work, implying that they did not enjoy the rest of the song."
i cant believe it only goes for 2 minutes 40. This is the WORST break up ive ever had,"I would classify this comment as Negative. The commenter expresses disappointment and frustration with the song's length, using strong language (""WORST"") to describe their experience of a breakup that they associate with the song."
Billie giving that slim shady going to the emmies vibes,"I would classify this comment as Positive. The mention of Billie ( likely referring to Billie Eilish) and the comparison to ""slim shady"" (a popular song by Eminem) implies admiration for her style and confidence, conveying a positive tone."
"for those, 1:37 is the partto vibe to 😍","I would classify this comment as Positive. The use of the smiling face emoji 😍 and the phrase ""the part to vibe to"" indicate that the commenter enjoyed a specific moment in the video and wants others to experience it too."
Deliciously trashy but classy and humourous. The track is positively a catchy bass grinder. A totally bitchin' duo.,I would classify this comment as Positive.
I CANT EXPLAIN IT BUT BILLE HERE GIVES ME HUGE CARL GALLAGHER VIBES,"I would classify this comment as Positive. Justification: The commenter is expressing admiration for the artist's style, comparing them favorably to another well-known musician (Carl Gallagher), which indicates a positive sentiment towards the video or the artist."
Essa música tem muito a vibe de 2012~2014,"I would classify this comment as Positive. The commenter uses the phrase ""tem muito a vibe"" which means ""has a lot of vibe"", implying that they enjoy the music and its nostalgic value, associating it with a specific period in time (2012-2014) that is likely fondly remembered."
"This is quite possibly the worst song I’ve ever heard in my life. Not only is the music terrible, the lyrics are completely lacking any substance whatsoever. 🤢","I would classify this comment as Negative. The commenter uses strong language to express their dislike for the song, calling it ""the worst"" and criticizing both the music and lyrics as ""terrible"" and ""lacking any substance"". The use of a vomiting emoji (🤢) further reinforces the negative tone."
This is the best lyrics they could come up with???!!!! 😂,"I would classify this comment as Negative. The phrase ""best lyrics they could come up with"" implies that the commenter is disappointed and unimpressed by the lyrics, despite the sarcastic tone being used to express their opinion."
This might be the worst thing I've ever seen or heard.,"Negative

Justification: The commenter uses strong language (""worst thing"") to express their intense dislike for the music video, indicating a strong negative sentiment."
Billie's verse is sexy af. 🥵,"I would classify this comment as Positive. The use of ""sexy"" to describe Billie's verse is an enthusiastic endorsement, and the added emojis (especially 😅) further convey a playful and approving tone."
The worst song of the year could have been better if the lyrics weren't so vulgar and bad.,"I would classify this comment as Negative. The user explicitly states that the song is ""the worst"" and criticizes its lyrics as ""vulgar and bad"", showing a strong negative sentiment towards the song."
These are literally the worst lyrics I have ever heard for a song... And people love it...,"I would classify this comment as Negative. The commenter explicitly states that they think the lyrics are ""the worst"" they've ever heard, which indicates a strong negative sentiment towards the content."
You wanna guess the color of my underwear (finish the lyrics),"I would classify this comment as Neutral. The comment is playful and light-hearted, but it doesn't express any strong emotions or opinions about the music video itself. It appears to be a humorous attempt to engage with others in completing the song lyrics."
Who’s dropping the lyrics,"I would classify this comment as Neutral. The commenter is simply asking about the presence of lyrics in the song, without expressing any opinion or emotion about the content of the video."
"No soul, no melody, no real instruments, nothing good about this. It's just bad and trashy.","I would classify this comment as Negative. The comment uses strong language to express dissatisfaction with the music video, calling it ""bad"" and ""trashy"", indicating a strongly negative sentiment."
"As a longtime fan (since 2014) I was extremely excited seeing Charli finally getting her flowers after decade+ of hard (and exceptional) work... the very day this song came out on the deluxe I was sending it to my friends, all elated that we got such a gem as an additional gift to already flawless body of music. I liked all of the remixes and was overall fascinated about how good of a rollout this era had. Unfortunately, this particular remix along with all of the excessive draining the brat trends in social made me stop listening to the album completely. Unnecessary, distasteful lesbian references from Billie along with her exceedingly forced what-is-supposed-to-be-sexy tone made the song unlistenable to me. It is such a shame that promotion of explicit, unnatural behavior in song widely used for shorts/tik tok dances mainly consumed by young teenagers is met with reception totally devoid of any criticism. To be clear - I very much like both of the ladies' music and I have no problem with people's sexual preferences, I just stand in opposition to widespread promotion of these ideas to kids. Also, sometimes less is more and this is the proof.","I would classify this comment as Mixed/Combination.

The comment starts out positively, expressing excitement and appreciation for Charli XCX's music and a well-executed rollout. However, it takes a negative turn when discussing the specific remix in question, citing distasteful references and an ""unnatural"" tone that makes the song unlistenable. The commenter also expresses concerns about the impact of explicit content on young teenagers. Overall, while there are positive sentiments expressed, the negative comments and criticisms outweigh the initial enthusiasm, making this a mixed sentiment analysis."
"Me gusta, Pero siento que a sus canciones les hace falta más contraste entre la tonalidad de las estrofas y los coros, y un mejor gancho. Que haga más fácil de recordar la canción. I like it, but I feel like their songs need more contrast between the tonality of the verses and choruses, and a better hook that would make the song easier to remember.","I would classify this comment as Positive with a touch of Constructive Criticism. The user starts by saying ""Me gusta"" (I like it), indicating overall positivity towards the music video, but then provides specific suggestions for improvement, showing they are invested in the artist's growth and want to see them reach their full potential."
Vocal fry gone mad. One you recognize it you realize this isn’t singing.,"I would classify this comment as Negative. The commenter uses strong language (""gone mad"") to criticize the vocal style, implying that it is unpleasant or unskilled, which indicates a negative sentiment."
Daft punk inspired chorus,"I would classify this comment as Neutral. The comment is not expressing a strong opinion or emotion about the music video, but rather making a factual comparison to Daft Punk's style, indicating that the video has some similar elements."
This song is such a vibe,"I would classify this comment as Positive. The phrase ""such a vibe"" suggests that the commenter has a strong positive emotional response to the song, implying that it's energetic, catchy, or enjoyable."
It sounds good but it's worst then lunch,"I would classify this comment as Negative. The user starts with a neutral statement ""it sounds good"", but then immediately expresses dissatisfaction by comparing the song to something that is considered pleasurable (lunch), implying that the song is not enjoyable."
1:37 I dance to this beat until dawn,"I would classify this comment as Positive. The commenter mentions dancing until dawn, implying that the song has energized them and helped them have a great time, which is a positive sentiment."
this is without a doubt one of the worst songs ever made.  actually makes womens underwear seem cringy.,"I would classify this comment as Negative. The commenter explicitly states that the song is ""one of the worst"" and uses strong language to convey their dislike, with phrases like ""without a doubt"" and ""cringy""."
Todays music is pretty bad it this is a hit. Wheres the melody? The good singing voice? Anyone can sing this,"I would classify this comment as Negative. The commenter expresses disappointment with today's music and criticizes the song for lacking melody and good singing, indicating a negative sentiment towards the song."
"This is not ORIGINAL 🤮, this is Daft Punk and Busta rhythm","I would classify this comment as Negative. The user explicitly states that the song is ""not original"" and compares it unfavorably to another artist's work (Daft Punk), implying that they do not like or approve of the music video."
Why the beat sound like main theme of the sims 2 Nightlife,I would classify this comment as Neutral. The comment is simply making an observation about the song's beat without expressing any positive or negative emotions towards it.
All the people loving this beat I guess never heard of Daft Punk 🤷,"I would classify this comment as Negative. The commenter is expressing skepticism about people's positive reactions to the song, implying that they must not be familiar with Daft Punk's music (and therefore their opinion isn't valid)."
and no offense but the english are the mostgod awful rapacious national there is,"I would classify this comment as Negative. The commenter uses strong language to describe the English, calling them ""god awful"" and ""rapacious"", which indicates a strongly negative sentiment towards the nationality mentioned."
These lyrics just make sense for Billie,"I would classify this comment as Positive. The commenter is expressing appreciation for the lyrics being relatable to Billie's song, indicating a positive sentiment towards the artist and their work."
"The lyrics is inspired by the women who say ""kis colour ke chaddi phene ho""....😂😂","I would classify this comment as Positive. The use of humor (""😂😂"") and the acknowledgement that the lyrics are ""inspired"" by something or someone suggests a lighthearted and appreciative tone, which is characteristic of positive sentiment."
This video gives such I’m A Slave 4 U vibes. I feel this’ll go down as this generation version of that. I love it,"I would classify this comment as Positive. The user explicitly states ""I love it"", which indicates a strong positive sentiment towards the music video, and they also compare it favorably to another popular song (""I'm A Slave 4 U""), suggesting high praise for the content."
