comentario,resposta_api
Reminds me of Kesha's song. Same horny vibe.,"I would classify this comment as Positive. The commenter is expressing a fond memory association with the song, comparing it to another popular song they enjoy, indicating a positive sentiment towards the music video."
Relax tempo,"I would classify this comment as Neutral. This is because the comment simply provides information about the tempo of the song without expressing any emotional tone or opinion, making it a neutral statement."
Nice beat,"I would classify this comment as Positive. The phrase ""nice beat"" is a common way to express admiration for a song's rhythm, indicating a positive sentiment towards the music."
"Ngl, 2009 vibes",I would classify this comment as Positive. The commenter is expressing nostalgia for a specific time period (2009) which implies a fondness for the song's style or era.
yall are beating a dead horse..................................,"I would classify this comment as Negative, because it uses a metaphor that implies the video is futile and wasting time."
It's the same beat as the song Wasapi,"I would classify this comment as Neutral. The commenter is simply stating a factual observation about the similarity between two songs, without expressing any emotional opinion or sentiment towards the music video itself."
One of the worst of 2024.  Devolution of talent & ideas.,"I would classify this comment as Negative. The use of strong language (""worst"") and phrases like ""devolution of talent & ideas"" convey a clear sense of disappointment and frustration, indicating a negative sentiment towards the music video."
Anyone else getting the Dirty from Christina vibes in this?,"I would classify this comment as Positive. The tone of the comment is enthusiastic and excited, as evidenced by the use of the phrase ""Anyone else"" which implies a sense of shared enthusiasm with the commenter."
"Guess?  I will only guess if I get my rules.  Because I'll be wrong.  Agree or disagree.  5.  4. That was quick.  God.  Did we even make it to the salad?  Okay, I'll guess but it won't work.  It'll be wrong.  I'm not throwing Diplo's underwear on there.  He has to throw it himself.  Oh, and Johnny Blue Skies.  I'm KEEPING Dove Cameron's underwear for myself and who would want what's his name's underwear?  Umm.  I say ""Use Me (Brutal Hearts).""  I know.  Wrong.  But it was a good guess.  AGAIN?  Fine.  Try...I found this one yesterday.  ""Driver's License"" By Olivia Rodrigo & ""Disease"" By Lady Gaga.  Last week, I think, there's ""Make You Mine"" By Madison Beer & ""STUPID feat. Yung Baby Tate"" By Ashnikko.  AS best I CAn teLl, ""15 Minutes"" By Madison Beer is also rolling with ""Pressure"" By Billy Joel.  It's a start.  My preamble is a wreck. I'm improving.  Oh, I had Serrano's with the moms today.  She got the kidney stones last week and I didn't hear about it until after the fact but she needed some help today and I'm off today so helped set up the new wifi and put things in the vehicle.  The grams died back in December so she's going back and forth dealing with stuff.  Yeah.  Woke up and...noticed Guess.  I don't know.  Day off.  Going back to day off.","I would classify this comment as Neutral, as it appears to be a mix of unrelated topics (music guessing game, personal experiences, and help with family matters). While the commenter does express some opinions about music choices, they also share personal anecdotes and show appreciation for their mom's well-being, which is not overtly positive or negative in tone."
"tja een Bromance met Zelensky is toch helemaal zo gek nog niet eigenlijk.. lekker potje ijshockeyen af en toe en ach zn engels wordt vast wel wat aantrekkelijker in de loop der tijd... daar moet je niet moeilijk over doen natuurlijk op mijn leeftijd is t ook wel een keertje mooi geweest zou je wijselijk denken en dan laat je meisjss voor w🎩 ze zijn en houd je op de koop toe je rug heel wie doet je w🎩 en kan ie meteen uit de doeken doen of ie nou een toneelstukje deed of niet... want man dan ja had ie trump stevig te pakken natuurlijk die ging er met boter en suiker in hopend op een ""miracle""...","I would classify this comment as Positive, because despite the commenter's lighthearted and humorous tone, they appear to be praising Zelensky's personality and sense of humor, using phrases like ""lekker potje ijshockeyen"" (meaning ""having a nice time"") and ""dat meisje is en houd je op de koop toe"" (which roughly translates to ""and then you just let the girl be""). The overall sentiment is playful and good-natured."
"Technologic by daft punk, same beat 🤯🤯🥵","I classify this comment as Positive.

Justification: The use of enthusiastic emojis (🤯🤯) and the phrase ""same beat"" implies that the commenter is excited about the music and has a strong positive reaction to it."
"It’s bringing back vibes of old skool video clips, what a clip and track","I would classify this comment as Positive. The commenter uses positive adjectives (""what a clip"" and ""old skool"") to express their enthusiasm and nostalgia for the music video."
is that what passes for singing these days? talking in a monotonous single tone?,"I would classify this comment as Negative. The commenter expresses disappointment and frustration with the singer's style, implying that it lacks soul and passion."
Lê Serafim vibes,"I would classify this comment as Positive. The mention of Lê Serafim's ""vibes"" implies that the commenter is fond of their music style or overall atmosphere, conveying a positive sentiment."
God this is such a melody😊,"I would classify this comment as Positive. The use of ""God"" to express strong enthusiasm and the smiling face emoji 😊 convey a sense of excitement and admiration for the song's melody."
fuuuuuck such a dope entrance... and verse,"I would classify this comment as Positive. The commenter uses enthusiastic language (""dope"") to express their excitement and approval of the artist's performance, indicating a positive sentiment towards the music video."
"I think Rosé will earn a nomination for best new artist, and probably for Best pop vocal album with Rosie","I classify this comment as Positive.

Justification: The commenter is expressing enthusiasm and optimism about Rosé's potential to receive awards, using phrases like ""I think"" and ""probably"", which convey a sense of confidence and encouragement."
Song lyrics really have gone to rubbish,"I would classify this comment as Negative. Justification: The comment explicitly states that song lyrics have ""gone to rubbish"", implying a strong dissatisfaction with the quality of the music."
RAVE VIBESSSSS 🎚,"Positive: The use of all-caps ""RAVE"" and emojis like 🎚 convey enthusiasm and excitement, indicating a positive sentiment."
Luciana vibes back in 2010 ❤,Positive: The use of the heart eyes emoji ❤️ indicates enthusiasm and fondness for the artist Luciana and her song from 2010.
Awesome beat and Colab ❤,"Positive: This comment expresses enthusiasm for the song's ""awesome beat"" and affection for the artist (""Colab""), indicating a positive sentiment."
Charli looks so beatiful😮😮😮😮WAOOOOO,"I would classify this comment as Positive. The use of words like ""beautiful"" and enthusiastic reactions (e.g., 😮) convey a strong positive sentiment towards the artist, Charli."
Im getting old - im 50 and id rather hear Oasis/ Stone Roses any day over this ' music ' .....( watching Charli at Glastonbury and im not impressed  - simply being honest....,"I would classify this comment as Negative. The commenter explicitly expresses their dislike for the music, comparing it unfavorably to other artists they prefer, and uses strong language to convey their disappointment (""Im not impressed"")."
Skins promo videos vibes,"I would classify this comment as Positive. The commenter is expressing a positive association with the ""vibes"" of the Skins promo videos, implying that they enjoyed the tone or atmosphere of the content."
Death becomes her vibes!!!,"I would classify this comment as Positive. The phrase ""becomes her vibes"" is likely being used to express enthusiasm and approval for the song's style, implying that it resonates well with the commenter."
i missed this rebel kesha vibe in pop music.,"I would classify this comment as Positive. The commenter is expressing nostalgia for a past era of Kesha's music (the ""Rebel"" era) and implies that they enjoyed it, suggesting a positive sentiment towards her work."
Hmmm .wow .... I mean I like the beat a lot when Billy comes in the beginning and crashes into the wall tho hmm get girl,"I would classify this comment as Positive. The commenter expresses liking for the music (""I mean I like the beat""), specifically mentioning a part that they enjoy, which is Billy's entrance with the crashing sound effect. Although there is some hesitation (""hmmm"") and casual language used, the overall tone is upbeat and enthusiastic."
What the hell did I just watch? I do like the beat.,"I would classify this comment as Neutral with a hint of Positivity. The user expresses surprise and potentially negative sentiment (""What the hell...""), but also mentions liking the beat, which adds a positive tone to their overall statement."
i dont wanna guess because you can't be serious about this song ( jk i like the daft punk vibe ),"I would classify this comment as Positive. The commenter starts by poking fun at the idea that they might not know what's going on, but then reveals their actual liking for the ""Daft Punk vibe"", showing a positive sentiment towards the song."
I love charlie xcx and her overall vibe,"I would classify this comment as Positive. The use of the phrase ""I love"" and the enthusiastic tone (""overall vibe"") indicate a strong appreciation for Charlie XCX's music and style."
The MTV Music vibes are STRONG 😩☝🏽 AND I’M HERE FOR IT,"I would classify this comment as Positive! The use of words like ""STRONG"" and the enthusiastic tone conveyed through the emojis (😩☝🏽) suggest that the commenter is excited and supports the music and vibe, which indicates a positive sentiment."
THE WAY MY JAW DROPPED ABOUT THE LYRICS ESPECIALLY BILLIE’S PART OMG💀💀💀,"Positive. The use of enthusiastic language such as ""OMG"" and emojis (e.g., 💀) indicates a strong emotional response, suggesting the commenter is highly pleased with the music video."
technologic vibes,"Positive

Justification: The use of ""vibes"" implies a positive emotional response to the music, suggesting that the commenter enjoys the song's atmosphere."
this party vibes is everything haha ❤,"I would classify this comment as Positive! The use of the phrase ""party vibes"" and the enthusiastic tone (""haha"") suggest that the commenter is expressing excitement and enjoyment. The heart eyes emoji (❤) further reinforces the positive sentiment, indicating that the commenter has a strong affection for the video's atmosphere."
Skins vibes,"I would classify this comment as Positive. The mention of ""Skins"" likely references a popular TV show known for its edgy content, implying that the commenter is drawing a connection between the show's tone and the music video's aesthetic or atmosphere, which suggests a positive association with the content."
"lots of ""technologic"" by Daft punk vibes","I would classify this comment as Positive. The commenter is expressing enthusiasm for the music video's similarity to a well-liked song (""Technologic"" by Daft Punk), indicating a positive sentiment towards the content."
whelp...music used to have good lyrics,"I would classify this comment as Negative. The commenter is expressing disappointment that music has lost its value by not having ""good"" lyrics anymore, implying a negative opinion about the current state of music."
Stone butch and femme les vibes,"I would classify this comment as Neutral. The phrase ""les vibes"" is likely being used to express a positive sentiment towards the LGBTQ+ community, but the overall tone of the comment is more descriptive and neutral than explicitly expressing joy or enthusiasm."
Electroclash revival is not needed. Cue dozens of minimal synth lines with hypersexual lyrics.,"I would classify this comment as Negative. The commenter explicitly states that an ""electroclash revival"" is not needed, indicating disapproval or opposition to the idea, and also criticizes the potential direction of the music by mentioning ""hypersexual lyrics"", implying a negative view of the content."
The song without notes😅😅😅,I would classify this comment as Positive because it is accompanied by multiple smiling face emojis (😅) indicating the commenter's enthusiasm and pleasure with the song.
"Daft Punk Technologic vibes! (In a really, reallt good way....)","I would classify this comment as Positive. The use of enthusiastic language such as ""really, really good"" and the mention of iconic artists like Daft Punk evoke a sense of excitement and admiration for the music video."
The beat 🥳🥳,"I would classify this comment as Positive. The use of emojis, such as 🥳, which are often used to express enthusiasm and excitement, suggests that the commenter is expressing a positive sentiment about the music video."
😅j'aime trop  set chanson 🎉🎉🎉🎉bonne anniverser🎉🎉🎉😊,"I would classify this comment as Positive. The use of emojis such as 😊, 🎉, and 🎉 indicates a strong positive sentiment towards the song, with phrases like ""j'aime trop"" (I love too much) further emphasizing the commenter's enthusiasm."
it’s giving Death Becomes Her vibes i love it,"I would classify this comment as Positive. The user explicitly states ""i love it"", which indicates a strong positive sentiment towards the music video."
Love the beat,"I would classify this comment as Positive. The user explicitly states they ""love"" the beat, indicating a strong positive sentiment towards the song's rhythm."
I just realised that The Dare is in the background at the beginning and then she mentions “send it to The Dare I think he’s with it”. Lol. Honestly great marketing from her side with the whole “brat girl summer” vibe going on and with The Dare’s new song coming out.,"I would classify this comment as Positive, because the commenter is praising the artist's ""great marketing"" and using phrases like ""Honestly great"" to express their enthusiasm for her strategy and the overall vibe of the music."
Giving me Gaga Just Dance and Miley Party USA vibes,"I would classify this comment as Positive. The user is drawing comparisons to popular and upbeat songs by well-known artists, implying that they enjoy the video's energy and tone."
The chorus sounds like Technologic 💀🤖,"I would classify this comment as Positive, justifying that it's an enthusiastic comparison between the song's chorus and another well-known and popular song (Technologic by Daft Punk), showing excitement and appreciation for the music."
"this is absolute artistry .. music, lyrics, video.  i want to hear it a thousand times","I would classify this comment as Positive.

This comment uses superlatives such as ""absolute artistry"" and expresses a strong desire to listen to the song repeatedly, indicating a high level of enthusiasm and admiration for the artist's work."
"Cringe dirty talk, music can be good without vulgar concepts and lyrics","I would classify this comment as Negative. The commenter uses strong language (""cringe"") to express their distaste for the explicit content, implying that it is unnecessary and even detracts from the quality of the music."
"ngecek doang...... the lyrics lmao whats wrong with ma girls, did she get h or  just caus of the beat 😂. funy.","I would classify this comment as Positive. The commenter is expressing amusement and laughter (""lmao"", ""😂""), praising the music's catchiness (""funy"" = funny), and making a lighthearted joke about the lyrics, indicating overall positivity towards the video."
The lyrics are deadly but the song n collab is slay,"I would classify this comment as Positive. The user praises both the song's ""deadly"" lyrics and the collaboration, using the slang term ""slay"" to convey strong approval."
It’s giving 2000s vibes and I’m here for it,"I would classify this comment as Positive. The phrase ""I'm here for it"" implies enthusiastic agreement and appreciation for the nostalgic vibe of the music video."
This beats and duo❤❤,"I classify this comment as Positive. The use of multiple heart symbols (❤❤) indicates strong enthusiasm and admiration for the ""beats"" (likely referring to the music) and duo, suggesting that the commenter has a very positive sentiment towards them."
"Music is good, not artists and lyrics 😐","I would classify this comment as Neutral. The commenter mentions that the ""music"" is good, which has a positive connotation, but also expresses dissatisfaction with the ""artists"" and ""lyrics"", which has a negative connotation. However, the use of the neutral emoji 😐 suggests that the overall sentiment is mixed or balanced."
PitchBlack,I would classify this comment as Neutral.
I didn't know a song about underwear could sound so catchy.,"I would classify this comment as Positive. The commenter is expressing surprise at how much they enjoy the song, using words like ""catchy"" to describe it, indicating a positive sentiment towards the music video."
Giving me - Like AG6 vibe,"I would classify this comment as Positive. The user is comparing the song to their favorite artist (AG6) and using the phrase ""giving me"", which implies that they are enjoying the music and feeling a strong connection to it."
This song slaps. Love the beat and also their voices just work so good together.,"I would classify this comment as Positive. The user uses the phrase ""this song slaps"" which is a colloquial expression meaning something is excellent or impressive, and they also mention that they love the beat and how the singers' voices work well together, indicating a strong positive sentiment towards the music."
sounds like a rip off of technologic by daft punk during the chorus usues the same beat so not really original but a decent song,"I would classify this comment as Neutral. The commenter expresses a mixed opinion, acknowledging that the song is ""decent"" while also criticizing it for being unoriginal and copying another artist's work (Technologic by Daft Punk)."
"This is unoriginal garbage , literally changing the lyrics to technologic with pervy stuff isnt ""art"" lol","I would classify this comment as Negative. The commenter uses strong language, calling the music ""unoriginal garbage"", and implies that it's not artistic by comparing it unfavorably to another song."
Too deep,"I would classify this comment as Neutral. The phrase ""too deep"" is often used to express that something is complex or profound, but doesn't necessarily convey a positive or negative sentiment towards the music video itself."
Loveeeeee this it has an old school beat in the early days of like sandstorm and David Guetta,"I would classify this comment as Positive. The use of multiple ""e""s in ""Loveeeeee"" conveys strong enthusiasm and affection for the music video, while the comparison to iconic songs from the past (""Sandstorm"", ""David Guetta"") highlights its nostalgic value and appreciation."
Billie a genius using lyrics to shoot her shot 😂,"I would classify this comment as Positive. The use of the phrase ""a genius"" and the smiling emoji (😂) clearly convey a positive sentiment towards Billie's music video."
What a delicious beat ❤,"I would classify this comment as Positive. The use of the word ""delicious"" to describe the beat is a clear expression of enthusiasm and appreciation for the song's rhythm, accompanied by a heart eyes emoji (❤), which further reinforces the positive sentiment."
Who is going to do a Mr Oizo Flat beat remix?,"I would classify this comment as Neutral. The comment is simply expressing a desire for a specific type of remix, without expressing any emotional sentiment towards the original song or the artist."
"Acapella 🌚 no está en acapella, habría que quitarle el autotune también","I would classify this comment as Negative. The commenter is expressing disappointment that the music video is not entirely acapella and suggests removing autotune to improve it, indicating a negative sentiment towards the current production quality."
I’m getting Eric Andre vibes here,"Neutral: The commenter is referencing a comedian known for his absurd humor, suggesting that they find the music video's tone or style similar to Eric Andre's."
"I love this song, but the quick chorus part sounds exactly like the bit from Technologic by Daft Punk :/","I would classify this comment as Neutral. The commenter expresses admiration for the song (""I love this song""), but also mentions a criticism (""the quick chorus part sounds exactly like...""). The tone is mixed, neither overwhelmingly positive nor negative."
Daft Punk - Technologic vibes.,"I classify this comment as Positive. The use of ""vibes"" to describe Daft Punk's song suggests a positive emotional response to the music, conveying a sense of enjoyment and appreciation."
Bloodhound Gang vibe,I would classify this comment as Neutral. This is because it's simply a reference to another artist/band (Bloodhound Gang) without expressing any clear opinion or emotion about the music video being commented on.
Awful,"Negative: This comment uses the strong negative word ""Awful"" to express dislike for the video."
"bangin beat, they both sound good, but the ending 'you wanna guess if we're serious about this song'  . .  is cringe","I would classify this comment as Mostly Negative. Although the commenter starts off positively by praising the beat and the singers, their criticism of the ending line (""is cringe"") overshadows any initial enthusiasm, making the overall tone of the comment negative."
I really like this song but I don't like about the underwear and stuff it's not giving the vibe,"I would classify this comment as Neutral. The commenter starts with a positive statement (""I really like this song""), but then expresses a negative opinion about the music video's content, which cancels out the positivity."
The beat is the clock level from mario 64.,"I would classify this comment as Positive because it's praising the song's beat, comparing it favorably to a well-known and iconic game sound effect, implying that the commenter thinks the music is excellent or unique."
That unibrow is awful,I would classify this comment as Negative. The commenter is expressing their dislike for the singer's appearance (unibrow) which indicates a negative sentiment towards them.
DAFT PUNK VIBES 🪬,"Positive: The commenter is expressing enthusiasm for the music style of Daft Punk, using a smiling face emoji to convey their positive sentiment."
I usually like both of their music but this wasn't very good. I started laughing and I don't think that was they were going for. Decent beat.,"I would classify this comment as Negative. Although the commenter mentions some positive aspects (laughing and decent beat), the overall tone is critical, stating that the video ""wasn't very good"" and implying that it missed its intended effect."
This gives Alejandro vibes,"I would classify this comment as Positive. The commenter is drawing a comparison between the video and another well-known and popular piece of content (Alejandro by Lady Gaga), implying that they enjoy the current video just as much."
I came here after listening to Stern... pretty dumb lyrics imho yet cash grab that pussy (yay?),"Negative

Justification: Although the commenter starts with a neutral tone by mentioning they were led here from another video, their criticism of the song's ""dumb"" lyrics and calling it a ""cash grab"" reveals a negative sentiment. The final phrase ""(yay?)"" appears to be sarcastic, further supporting the classification as Negative."
"bodyrox  yeah yeah yeah vibe, you yanks wont know","I would classify this comment as Positive.

Justification: The commenter uses enthusiastic language (""yeah yeah yeah"") and expresses appreciation for the song's ""vibe"", indicating a positive sentiment."
The vibe is GOOD!!!,"I would classify this comment as Positive because it explicitly states that the ""vibe"" (or atmosphere) of the music video is good, using all capital letters to emphasize its positivity."
Beatifull 😍😍😍,"Positive: The excessive use of smiling emojis (😍) and the word ""beautifull"" suggest that the commenter is expressing strong enthusiasm and admiration for the music video."
"The song is good, but the lyrics and the video😢","I would classify this comment as Mixed (not a standard option, but I'll explain). The comment starts with a positive statement about the song being ""good"", which suggests a positive sentiment. However, it's followed by criticism of the lyrics and video, which introduces negative sentiments. Since both positive and negative sentiments are present, I wouldn't categorize it as purely Positive or Negative."
So glad they are getting the attention ❤vocals are insane,"I would classify this comment as Positive. The commenter uses phrases like ""so glad"" and ""insane"", indicating their enthusiasm and admiration for the music video and vocals."
